Business Intelligence Analyst - Data Engineering,Medpace,On-site,"SQL, Python, business intelligence, data visualization",2026-05-14,159100.0,159100.0,Cincinnati, OH,US,True,False,False
Senior Power BI Developer,The Hearst Corporation,On-site,"SQL, Power BI, data visualization, data modeling, data warehousing, data governance, business intelligence",2026-05-14,159100.0,159100.0,Charlotte, NC,US,True,False,False
Business Intelligence Manager,Medpace,On-site,"SQL, Power BI, ETL, business intelligence, data visualization",2026-04-03,159100.0,159100.0,Cincinnati, OH,US,True,False,False
Business Intelligence Analyst,Goldbelt,On-site,"Azure, Agile, Scrum, business intelligence, cybersecurity",2026-05-21,159100.0,159100.0,Mechanicsburg, PA,US,True,False,False
Sr Manager - Business Intelligence,Uniti,On-site,"Tableau, Power BI, business intelligence, data visualization",2026-05-28,159100.0,159100.0,Lexington, KY,US,True,False,False
Sr Manager - Business Intelligence,Uniti,On-site,"Tableau, Power BI, business intelligence, data visualization",2026-05-28,159100.0,159100.0,Charlotte, NC,US,True,False,False
Sr Manager - Business Intelligence,Uniti,On-site,"Tableau, Power BI, business intelligence, data visualization",2026-05-28,159100.0,159100.0,Little Rock, AR,US,True,False,False
Power BI Analyst,Samet,On-site,"SQL, Python, Tableau, Power BI, Looker, ETL, business intelligence, data visualization",2026-05-29,159100.0,159100.0,Greensboro, NC,US,True,False,False
"Director, Business Intelligence",Cleveland Cavaliers,On-site,"SQL, Python, R, business intelligence, data visualization",2026-05-29,159100.0,159100.0,Cleveland, OH,US,True,False,False
Business Intelligence Analyst/Developer,Exelo Technologies Inc,Hybrid,"SQL, Tableau, ETL",2026-05-18,159100.0,159100.0,Hartford, CT,US,True,False,False
Business Intelligence Architect/Developer,American business solutions inc,Remote,Tableau,2026-05-18,159100.0,159100.0,Denver, CO,US,True,False,False
Power BI Visualization Developer,MTSI,On-site,"Tableau, Power BI, data visualization, cybersecurity",2026-05-18,159100.0,159100.0,Huntsville, AL,US,True,False,False
Senior Business Analyst,Ameriprise Financial,Remote,,2026-05-20,112300.0,112300.0,Minneapolis, MN,US,True,False,False
Business Intelligence Analyst,Plateau Software Inc,On-site,"SQL, Tableau, Power BI, business intelligence, SAP",2026-05-19,159100.0,159100.0,Fayetteville, NC,US,True,False,False
Advana / Jupiter Data Developer & Business Analyst,ORGRO,Hybrid,"SQL, Python, Tableau, Power BI, machine learning, Agile, data visualization",2026-05-15,159100.0,159100.0,Washington, DC,US,True,False,False
BI Developer,Daisy Brand,Hybrid,"SQL, Tableau, Power BI, ETL, Azure, data visualization",2026-05-20,159100.0,159100.0,Dallas, TX,US,True,False,False
Business Analyst,NIKE,On-site,"SQL, Python, R, Tableau, data visualization",2026-05-28,159100.0,159100.0,Beaverton, OR,US,True,False,False
Healthcare Business Intelligence Analyst III- Service Line,Baptist Health System KY & IN,Remote,"Excel, Tableau, business intelligence",2026-05-28,159100.0,159100.0,KY, US,US,True,False,False
Healthcare Business Intelligence Analyst III- Pharmacy,Baptist Health System KY & IN,Remote,"Excel, Tableau, business intelligence",2026-05-28,159100.0,159100.0,KY, US,US,True,False,False
"Sr Business Analyst, NetSuite Practice",BTM Global,On-site,"Excel, Oracle",2026-05-11,159100.0,159100.0,Edina, MN,US,True,False,False
Business Intelligence Developer II,D.R. Horton,On-site,"SQL, R, Power BI, Snowflake, ETL, business intelligence",2026-05-21,159100.0,159100.0,Arlington, TX,US,True,False,False
Business Intelligence Developer 1,Brasfield & Gorrie,On-site,"Power BI, business intelligence",2026-03-13,159100.0,159100.0,Atlanta, GA,US,True,False,False
Power BI & Data Architect - Bold Cape,,Hybrid,"SQL, Power BI, ETL, Agile, business intelligence, data visualization, Oracle",2026-05-22,159100.0,159100.0,Wright-Patterson AFB, OH,US,True,False,False
Business Intelligence Developer,blue water Thinking,Remote,"SQL, Python, R, Tableau, Power BI, SAS, Azure, machine learning, business intelligence, data visualization",2026-05-27,159100.0,159100.0,Remote, US,US,True,False,False
"Senior Business Analyst, Commercial Economics",Internet Brands,Hybrid,"SQL, Excel, Tableau",2026-04-09,159100.0,159100.0,Minneapolis, MN,US,True,False,False
Business Intelligence Analyst Senior,Geisinger,Remote,"SQL, R, Tableau, Databricks, business intelligence",2026-05-26,159100.0,159100.0,Remote, US,US,True,False,False
Healthcare Business Intelligence Analyst III- Solution Development,Baptist Health System KY & IN,Remote,"Excel, Tableau, business intelligence",2026-05-28,159100.0,159100.0,KY, US,US,True,False,False
BI Developer/ Data Engineer,City Mattress,Hybrid,"SQL, Python, Power BI, ETL, Azure, business intelligence",2026-05-28,159100.0,159100.0,Bonita Springs, FL,US,True,False,False
Business Intelligence / Project Manager : W2 Role,HARAMAIN SYSTEMS INC.,Remote,"SQL, Tableau, Power BI, Looker, Snowflake, ETL, AWS, Azure, Agile, Scrum, business intelligence, Oracle",2026-05-28,159100.0,159100.0,Dallas, TX,US,True,False,False
Epic Business Intelligence Developer,Choctaw Nation of Oklahoma,Hybrid,"SQL, business intelligence",2026-05-28,159100.0,159100.0,Talihina, OK,US,True,False,False
Technical Business Analyst,Elder Research Inc,Hybrid,"SQL, Python, R, Excel, Tableau, Power BI, Looker, ETL, AWS, Azure, GCP, Agile, data visualization",2026-05-29,159100.0,159100.0,Raleigh, NC,US,True,False,False
BI Developer / Data Analyst,Eye Health America,On-site,"SQL, Tableau, Power BI, ETL, business intelligence",2026-05-28,159100.0,159100.0,Greenville, SC,US,True,False,True
Business Intelligence Developer,Jacksons Food Stores,On-site,"SQL, Excel, Power BI, ETL, business intelligence, data visualization",2026-05-29,159100.0,159100.0,Meridian, ID,US,True,False,False
Power BI Lead Developer / Architect – Microsoft Fabric,Nova Web Technologies,On-site,"SQL, Python, Power BI, Azure, business intelligence",2026-05-29,159100.0,159100.0,Atlanta, GA,US,True,False,False
Senior Business Intelligence Engineering and Data Manager,Safelite,On-site,"SQL, Python, Tableau, Snowflake, business intelligence, Workday",2026-05-29,159100.0,159100.0,Columbus, OH,US,True,False,False
BUSINESS INTELLIGENCE DEV II,Moffitt Cancer Center,On-site,"SQL, Tableau, Power BI, Snowflake, ETL, Oracle, data modeling, data warehousing, business intelligence",2026-05-22,159100.0,159100.0,Tampa, FL,US,True,False,False
"Rise Analytics-AVP, Business Intelligence",Trellance,On-site,"SQL, Power BI, Snowflake, dbt, Azure, data modeling, business intelligence, forecasting, Microsoft Fabric",2026-05-13,159100.0,159100.0,Tampa, FL,US,True,False,False
Sr. Business Analyst - Workforce Management & HCM,Bealls Inc.,Hybrid,"SQL, Oracle, forecasting",2026-04-22,159100.0,159100.0,Bradenton, FL,US,True,False,False
Finance Power BI Manager,Holland & Knight,On-site,"Excel, Power BI, Azure, data modeling, Microsoft Fabric",2026-04-14,159100.0,159100.0,Brandon, FL,US,True,False,False
Senior Workday Business Analyst (IT),Raymond James,Hybrid,Agile,2026-04-27,159100.0,159100.0,Saint Petersburg, FL,US,True,False,False
Workday Senior Business Analyst,"Power Design, Inc.",On-site,Agile,2026-04-07,159100.0,159100.0,Saint Petersburg, FL,US,True,False,False
Director of Business Intelligence - Healthcare,Summit Behavioral Healthcare,Remote,"SQL, Python, Power BI, data modeling, data warehousing, data governance, business intelligence",2026-05-11,159100.0,159100.0,Franklin, TN,US,True,False,False
Document Management Business Analyst - US HYBRID,DXC Technology,On-site,Power BI,2026-05-14,159100.0,159100.0,Nashville, TN,US,True,False,False
Sr Business Analyst - Order Engineering,Schneider Electric,On-site,SAP,2026-04-27,159100.0,159100.0,Franklin, TN,US,True,False,False
Sr Business Analyst - Plant Order Engineering,Schneider Electric,Hybrid,SAP,2026-04-27,159100.0,159100.0,Nashville, TN,US,True,False,False
Sr Business Analyst SC Planning - Upstream,Schneider Electric,Remote,"SAP, forecasting",2026-04-21,159100.0,159100.0,Franklin, TN,US,True,False,False
"SR DIRECTOR, DECISION SCIENCE & BUSINESS INTELLIGENCE",Dollar General,On-site,"SQL, Python, R, Tableau, business intelligence",2026-04-14,159100.0,159100.0,Goodlettsville, TN,US,True,False,False
BI Developer III,Yale New Haven Health,On-site,"SQL, Tableau, ETL, business intelligence, SAP, networking",2026-03-26,159100.0,159100.0,New Haven, CT,US,True,False,False
Analyst - Valuations & Business Intelligence Reporting,"AGNC Mortgage Management, LLC",Hybrid,"SQL, Python, Excel, Power BI, statistics, business intelligence, forecasting",2026-05-12,159100.0,159100.0,Bethesda, MD,US,True,False,False
Power BI Database Engineer,Entarian,On-site,"SQL, Python, R, Tableau, Power BI, Databricks, ETL, AWS, Azure, Google Cloud, Oracle, data visualization, data modeling, data warehousing, business intelligence",2026-05-07,159100.0,159100.0,Arlington, VA,US,True,False,False
Microsoft Dynamics 365 Business Analyst,Hendrick Motorsports,On-site,"SQL, Power BI, Azure, Agile",2026-04-07,159100.0,159100.0,Charlotte, NC,US,True,False,False
Senior Business Analyst - Regulatory Reporting,NTT DATA,Hybrid,"R, data governance",2026-05-11,159100.0,159100.0,Jersey City, NJ,US,True,False,False
Business Analyst,Genuine Parts Giant,On-site,"SQL, Excel, Tableau, Power BI, data visualization",2026-04-07,159100.0,159100.0,Los Angeles, CA,US,True,False,False
NetSuite Administrator and Business Analyst,Sun Health,On-site,,2026-05-21,99260.0,99260.0,Surprise, AZ,US,True,False,False
Business Analyst,Advanced Technology Systems Company,Hybrid,"Excel, Tableau, Power BI, Jira, Agile, data visualization",2026-05-19,159100.0,159100.0,Gilbert, AZ,US,True,False,False
Business Analyst,U-Haul,On-site,Excel,2026-05-18,159100.0,159100.0,Phoenix, AZ,US,True,False,False
Business Analyst IT Supply Chain,Academy Sports + Outdoors,On-site,JSON,2026-04-14,159100.0,159100.0,Katy, TX,US,True,True,False
Business Analyst and Project Coordinator,First Credit Union,Remote,"Excel, Scrum",2026-04-29,159100.0,159100.0,Chandler, AZ,US,True,False,False
Category Business Analyst,,On-site,Power BI,2026-05-08,159100.0,159100.0,Warminster, PA,US,True,False,False
Business Analyst,Independence Blue Cross,Hybrid,"SQL, Excel, Tableau, Power BI",2026-05-26,159100.0,159100.0,Philadelphia, PA,US,True,False,False
Drexel Co-Op: Business Analyst,NBME,On-site,Excel,2026-04-30,159100.0,159100.0,Philadelphia, PA,US,True,False,False
Ad/Email Business Analyst-Marketing Execution-Senior Associate,JPMorganChase,On-site,"Excel, Agile",2026-04-29,159100.0,159100.0,Newark, DE,US,True,True,False
College Co-op: Supplemental Programs Business Analyst,Independence Blue Cross,On-site,Excel,2026-04-25,159100.0,159100.0,Philadelphia, PA,US,True,False,False
ERP Business Analyst - Inventory Management & Supply Chain,East Penn Manufacturing,On-site,"Power BI, SAP, data governance",2026-04-21,159100.0,159100.0,Lyon Station, PA,US,True,True,False
ERP Business Analyst - Budgeting and Financial Management,East Penn Manufacturing,On-site,"Power BI, SAP, data governance, forecasting",2026-04-21,159100.0,159100.0,Lyon Station, PA,US,True,False,False
ERP Business Analyst - Production/Manufacturing and Demand Forecasting,East Penn Manufacturing,On-site,"Power BI, SAP, data governance, forecasting",2026-04-21,159100.0,159100.0,Lyon Station, PA,US,True,False,False
ERP Business Analyst - Distribution & Warehouse,East Penn Manufacturing,On-site,"Power BI, SAP, data governance",2026-04-21,159100.0,159100.0,Lyon Station, PA,US,True,False,False
ERP Business Analyst - Sales & Customer Service,East Penn Manufacturing,On-site,"Power BI, SAP, data governance",2026-04-21,159100.0,159100.0,Lyon Station, PA,US,True,False,False
ERP Business Analyst,Core BTS,On-site,"SAP, data governance, business intelligence",2026-04-20,159100.0,159100.0,Lyons, PA,US,True,False,False
Healthcare Value Optimization Business Analyst Senior,AmeriHealth Caritas,Hybrid,"SQL, Excel, Tableau",2026-04-15,159100.0,159100.0,Newtown Square, PA,US,True,False,False
Guidewire Development Business Analyst,Tata Consultancy Services (TCS),On-site,,2026-05-21,190000.0,190000.0,San Antonio, TX,US,True,False,False
Software Business Analyst I,Terex Corporation,Remote,"Excel, Power BI",2026-05-19,159100.0,159100.0,San Diego, CA,US,True,False,False
Quality Business Analyst,Independence Blue Cross,On-site,Excel,2026-04-10,159100.0,159100.0,Philadelphia, PA,US,True,False,False
IT Business Analyst,Brightview,On-site,"SQL, Excel, Tableau, Power BI, SAP, Oracle, Agile, data governance, business intelligence",2026-04-08,159100.0,159100.0,Blue Bell, PA,US,True,False,False
Business Analyst,University Health,On-site,,2026-05-20,5760.0,5760.0,San Antonio, TX,US,True,False,False
Business Analyst,University health San Antonio,On-site,,2026-05-20,5760.0,5760.0,San Antonio, TX,US,True,False,False
Software Business Analyst II,Terex Corporation,Remote,Excel,2026-05-11,159100.0,159100.0,San Diego, CA,US,True,False,False
Senior Business Analyst,,On-site,"SQL, Excel, Tableau, Power BI, business intelligence",2026-04-20,159100.0,159100.0,Roanoke, TX,US,True,False,False
Business Analyst,,On-site,"SQL, Excel, data visualization, forecasting",2026-04-16,159100.0,159100.0,Dallas, TX,US,True,False,False
ERP Business Analyst,SPR Packaging,On-site,"Excel, Power BI",2026-04-15,159100.0,159100.0,Rockwall, TX,US,True,False,False
Business Analyst (Information Systems),Vantage Bank Texas,On-site,"Azure, Jira, Agile, Scrum",2026-04-06,159100.0,159100.0,Fort Worth, TX,US,True,False,False
TPO Business Analyst,Qcells,Remote,"SQL, Excel, Tableau, Looker, Jira",2026-04-17,159100.0,159100.0,San Francisco, CA,US,True,False,False
TPO Business Analyst,Qcells,Remote,"SQL, Excel, Tableau, Looker, Jira",2026-04-17,159100.0,159100.0,Santa Clara, CA,US,True,False,False
Business Analyst II,DHI Mortgage,On-site,R,2026-05-01,159100.0,159100.0,Austin, TX,US,True,False,False
Ops & Business Analyst II,Lower Colorado River Authority,On-site,"Tableau, Power BI, Oracle, data visualization, forecasting",2026-04-20,159100.0,159100.0,Austin, TX,US,True,False,False
GDI Business Analyst Intern - OVIP,Oracle,On-site,Oracle,2026-05-20,159100.0,159100.0,Austin, TX,US,True,False,False
Business Analyst,University of Texas at Austin,Remote,"statistics, Agile",2026-05-15,159100.0,159100.0,Austin, TX,US,True,False,False
"Business Analyst, Customer Operations (Starlink)",SpaceX,On-site,"SQL, Python, R, Tableau, Power BI, Looker, ETL, data visualization",2026-05-06,159100.0,159100.0,Bastrop, TX,US,True,False,False
AI & Automation Business Analyst,Emerson,Hybrid,Snowflake,2026-04-27,159100.0,159100.0,Austin, TX,US,True,True,False
Business Analyst,Jacobs,Hybrid,,2026-05-27,157275.0,157275.0,Denver, CO,US,True,False,False
Project Manager / Business Analyst - AI Initiatives,RubinBrown,Hybrid,data governance,2026-04-16,159100.0,159100.0,Denver, CO,US,True,True,False
Business Analyst - Enterprise Applications,Samsonite,Hybrid,Jira,2026-04-08,159100.0,159100.0,Mansfield, MA,US,True,False,False
Operations Business Analyst - Rental Resources,The Home Depot,On-site,statistics,2026-05-08,159100.0,159100.0,Atlanta, GA,US,True,False,False
Operations Business Analyst - Energy Management,The Home Depot,On-site,"statistics, forecasting",2026-05-07,159100.0,159100.0,Atlanta, GA,US,True,False,False
Business Analyst Manager,Palm Medical Centers,Hybrid,"SQL, Excel",2026-05-27,159100.0,159100.0,Coral Gables, FL,US,True,False,False
Business Analyst III,,Hybrid,,2026-05-27,124200.0,124200.0,Doral, FL,US,True,False,False
Business Analyst II,Lennar,On-site,"Power BI, Oracle, Agile, forecasting",2026-05-27,159100.0,159100.0,Miami, FL,US,True,False,False
Logistics Business Analyst,4B Global LLC,On-site,"SQL, Python, Excel, Power BI, business intelligence, forecasting",2026-05-13,159100.0,159100.0,Hialeah, FL,US,True,False,False
Delivery Manager / Business Analyst – Public Sector,Data Meaning,Remote,"Tableau, Power BI, Azure, Alteryx, Jira, Agile, Scrum, data warehousing, business intelligence",2026-05-12,159100.0,159100.0,Boca Raton, FL,US,True,False,False
Sr Operations Business Analyst,The Home Depot,On-site,statistics,2026-04-14,159100.0,159100.0,Atlanta, GA,US,True,False,False
"SAP Business Analyst (SD, CO, FI, PS)",Hitachi Energy,Remote,SAP,2026-04-13,159100.0,159100.0,Atlanta, GA,US,True,False,False
Business Analyst SME,i3 Consulting,On-site,"Jira, Agile",2026-05-26,159100.0,159100.0,Chantilly, VA,US,True,False,False
Business Analyst,Tata Consultancy Services (TCS),On-site,,2026-05-26,135000.0,135000.0,Manassas, VA,US,True,False,False
Business Analyst (Renewable Natural Gas),WAGA ENERGY,On-site,Excel,2026-04-20,159100.0,159100.0,Miami, FL,US,True,False,False
Banking Business Analyst,City National Bank of Florida,On-site,Excel,2026-04-07,159100.0,159100.0,Coral Gables, FL,US,True,False,False
Banking Business Analyst,City National Bank of Florida,On-site,Excel,2026-04-07,159100.0,159100.0,Miami, FL,US,True,False,False
Business Analyst,Pansophic Learning,On-site,Agile,2026-05-27,159100.0,159100.0,Tysons Corner, VA,US,True,False,False
Perioperative Systems Business Analyst,Mercy Health Services (MD),On-site,,2026-05-19,10720.0,10720.0,Baltimore, MD,US,True,False,False
Business Analyst,"Arthritis & Rheumatism Associates, PC",Hybrid,forecasting,2026-05-21,159100.0,159100.0,Rockville, MD,US,True,False,False
Software System Tester/Business Analyst,Accenture Federal Services,On-site,,2026-05-21,119100.0,119100.0,Springfield, VA,US,True,False,False
Business Analyst - Mid Level,Parsons,On-site,"Excel, Jira",2026-05-21,159100.0,159100.0,Springfield, VA,US,True,False,False
Business Analyst/Tester,Indev,Hybrid,"Jira, Agile",2026-05-19,159100.0,159100.0,Washington, DC,US,True,False,False
Senior Business Analyst,Parsons,On-site,"Tableau, data visualization",2026-05-21,159100.0,159100.0,Springfield, VA,US,True,False,False
Senior Business Analyst (Team Lead) - Integrator,Parsons,On-site,"Tableau, data visualization",2026-05-21,159100.0,159100.0,Springfield, VA,US,True,False,False
Business Analyst,Advanced Technology Systems Company,Hybrid,"Excel, Tableau, Power BI, Jira, Agile, data visualization",2026-05-20,159100.0,159100.0,McLean, VA,US,True,False,False
Business Analyst - Junior Level,Parsons,On-site,"Excel, Tableau, Jira",2026-05-20,159100.0,159100.0,Springfield, VA,US,True,False,False
Business Analyst Mid,TULK llc,On-site,,2026-05-16,142600.0,142600.0,Springfield, VA,US,True,False,False
Business Analyst Mid,TULK llc,On-site,,2026-05-16,142600.0,142600.0,McLean, VA,US,True,False,False
Business Analyst,AM General,On-site,"R, Excel",2026-04-21,159100.0,159100.0,Auburn Hills, MI,US,True,False,False
Business Analyst Team Lead (Remote),FEI Systems,Hybrid,"Agile, Scrum",2026-05-15,159100.0,159100.0,Columbia, MD,US,True,False,False
Business Analyst / Project Manager,Everforth ECS,On-site,"Agile, Scrum",2026-04-30,159100.0,159100.0,Arlington, VA,US,True,False,False
Business Analyst / PMO Intern,Autoliv United States,On-site,"Excel, Power BI",2026-05-15,159100.0,159100.0,Auburn Hills, MI,US,True,False,False
Executive Admin-Business Analyst,Aerostar Manufacturing,Hybrid,Excel,2026-05-14,159100.0,159100.0,Romulus, MI,US,True,False,False
Business Analyst for Research Systems,University of Minnesota,Remote,"statistics, Agile",2026-05-28,159100.0,159100.0,Minneapolis, MN,US,True,False,False
Business Analysts,Administrative Controls Management,On-site,forecasting,2026-04-17,159100.0,159100.0,Charlotte, NC,US,True,False,False
Revenue Operations Business Analyst,ANAZAOHEALTH,On-site,"Excel, Power BI",2026-05-21,159100.0,159100.0,Tampa, FL,US,True,False,False
Sr. ServiceNow Business Analyst,Guidehouse,On-site,"Tableau, Power BI, Databricks, Agile, Scrum",2026-05-19,159100.0,159100.0,Tampa, FL,US,True,False,False
ServiceNow Business Analyst,Guidehouse,On-site,"Tableau, Power BI, Databricks, Agile, Scrum",2026-05-19,159100.0,159100.0,Tampa, FL,US,True,False,False
Senior Business Analyst,The Home Depot,On-site,,2026-05-28,108000.0,108000.0,Vancouver, WA,US,True,False,False
Business Analyst,,Remote,,2026-05-22,149091.0,149091.0,Vancouver, WA,US,True,False,False
Business Analyst Intern,DKS Associates,Hybrid,"Python, R, Tableau, Power BI",2026-05-20,159100.0,159100.0,Portland, OR,US,True,False,False
Business Analyst / Business Process,AZAD Technology Partners,Hybrid,,2026-05-02,10080.0,10080.0,Vancouver, WA,US,True,False,False
Operations Business Analyst 3,Lam Research,Hybrid,"Excel, Jira, forecasting",2026-04-22,159100.0,159100.0,Tualatin, OR,US,True,False,False
BUSINESS INTELLIGENCE & ANALYTICS SR MANAGER -OPERATIONS,Dollar General,On-site,"SQL, Python, data visualization",2026-05-20,159100.0,159100.0,Goodlettsville, TN,US,True,False,False
Syspro Business Analyst,ICP Group,Remote,"SQL, Excel",2026-05-22,159100.0,159100.0,Tampa, FL,US,True,False,False
"Lead, Salesforce Business Analyst",Schneider Electric,Remote,SQL,2026-04-27,159100.0,159100.0,Franklin, TN,US,True,False,False
Finance Lead Business Analyst,Schneider Electric,On-site,"SAP, Scrum",2026-04-24,159100.0,159100.0,Nashville, TN,US,True,False,False
Retail Business Analyst,Cracker Barrel,On-site,"Excel, data visualization",2026-04-22,159100.0,159100.0,Lebanon, TN,US,True,True,False
Commercial Card Business Analyst - Payments - Associate,JPMorganChase,On-site,Excel,2026-04-26,159100.0,159100.0,Tampa, FL,US,True,False,False
Manager Business Intelligence,Thomas Jefferson University & Jefferson Health,On-site,business intelligence,2026-05-26,159100.0,159100.0,Fort Washington, PA,US,True,False,False
"Senior Manager, Business Intelligence Data Engineering",Washington Nationals,On-site,"SQL, Python, Excel, Tableau, dbt, ETL, GCP, Google Cloud, machine learning, BigQuery, data modeling, data warehousing, business intelligence, forecasting, Airflow",2026-05-08,159100.0,159100.0,Washington, DC,US,True,False,False
Financial Analyst-Business Intelligence,City National Bank of Florida,On-site,"SQL, Excel, business intelligence",2026-04-27,159100.0,159100.0,Miami, FL,US,True,False,False
BI Developer,"Augeo Affinity Marketing, Inc.",Hybrid,"SQL, Tableau, Power BI, Looker, Snowflake, ETL, statistics, Qlik, data warehousing, business intelligence",2026-05-13,159100.0,159100.0,Saint Paul, MN,US,True,False,False
Business Analyst,TP,Hybrid,"SQL, Excel",2026-05-15,159100.0,159100.0,Toronto, ON,US,True,False,False
Business Analyst + Quality Assurance (ICI Impact),Exadel,Hybrid,"SQL, Excel, Jira",2026-05-13,159100.0,159100.0,Toronto, ON,US,True,False,False
IT Business Analyst II,Leon's Furniture,Hybrid,"Jira, Agile, Scrum",2026-05-12,159100.0,159100.0,Toronto, ON,US,True,False,False
Business Analyst,All-Fab Building Components,On-site,"SQL, Python, Power BI, data warehousing, business intelligence, Airflow",2026-05-07,159100.0,159100.0,Balzac, AB,US,True,False,False
Sophomore Summer Business Analyst Intern,McKinsey & Company,On-site,Excel,2026-04-29,159100.0,159100.0,Calgary, AB,US,True,False,False
Business Analyst,MNP,Hybrid,"Excel, Azure, Agile",2026-04-21,159100.0,159100.0,Calgary, AB,US,True,False,False
Technical Business Analyst,Boardwalk,Hybrid,Agile,2026-05-13,159100.0,159100.0,Calgary, AB,US,True,False,False
Senior Business Analyst - Health Insurance (Fully Remote),COVERGO,Remote,"Agile, Scrum",2026-05-08,159100.0,159100.0,Calgary, AB,US,True,False,False
Business Analyst,Catalis Holdco Inc,On-site,"SQL, Excel, forecasting",2026-05-15,159100.0,159100.0,Edmonton, AB,US,True,False,False
Senior Business Analyst,Catalis Holdco Inc,On-site,Jira,2026-05-15,159100.0,159100.0,Edmonton, AB,US,True,False,False
Technical Business Analyst,Vantix Systems Inc,On-site,"SQL, JSON",2026-05-12,159100.0,159100.0,Edmonton, AB,US,True,False,False
IT Technical Business Analyst,Vantix Systems Inc,On-site,data governance,2026-05-04,159100.0,159100.0,Edmonton, AB,US,True,False,False
Technical Business Analyst lll,North American Construction Group,On-site,SQL,2026-04-21,159100.0,159100.0,Acheson, AB,US,True,False,False
Business Analyst (Accounting & Financial Operations,Albion Marine Solutions Ltd,On-site,forecasting,2026-04-10,159100.0,159100.0,Port Coquitlam, BC,US,True,False,False
"Infrastructure & Capital Projects - Power BI Analyst, COM",Accenture,On-site,"SQL, Python, R, Excel, Power BI, ETL, Oracle, Java",2026-04-24,159100.0,159100.0,Toronto, ON,US,True,False,False
Business Intelligence Analyst,EF Education First,Hybrid,"SQL, Excel, Power BI, Spark, Snowflake, business intelligence, forecasting",2026-04-15,159100.0,159100.0,Toronto, ON,US,True,False,False
Senior Business Intelligence Engineer,Braze,Hybrid,"SQL, Snowflake, dbt, data modeling, business intelligence, Airflow",2026-04-22,159100.0,159100.0,Toronto, ON,US,True,False,False
Business Analyst - Analytics & Insights,Roadpost,Hybrid,"SQL, Tableau, Looker",2026-04-21,159100.0,159100.0,Toronto, ON,US,True,False,False
Senior Consultant – Data & Analytics (Microsoft Fabric | Power BI | Databricks),Quisitive,Remote,"SQL, Python, Power BI, Spark, Databricks, Azure, Microsoft Fabric, Synapse",2026-05-21,159100.0,159100.0,Dallas, TX,US,True,False,False
Senior Business Intelligence/Financial Analyst (Financial Planning and Performance),Partners Community Health,On-site,"Excel, Power BI, business intelligence, forecasting",2026-04-16,159100.0,159100.0,Mississauga, ON,US,True,False,False
Sr. Business Intelligence Analyst,Loopio,Remote,"SQL, Tableau, data modeling, data warehousing, data governance, business intelligence",2026-04-15,159100.0,159100.0,Toronto, ON,US,True,False,False
Business Analyst - Planning & Economics,China National Offshore Oil,On-site,Excel,2026-05-21,159100.0,159100.0,Calgary, AB,US,True,False,False
Business Analyst - Summer Student,Jori International,On-site,Excel,2026-04-28,159100.0,159100.0,Calgary, AB,US,True,False,False
