"Senior Business Analyst - HR Integration, Remote",Providence,Remote,"SQL, statistics",2026-05-29,159100.0,159100.0,WA, US,US,True,False,False
"Senior Business Analyst - HR Integration, Remote",Providence,Remote,"SQL, statistics",2026-05-29,159100.0,159100.0,CA, US,US,True,False,False
"Senior Business Analyst - HR Integration, Remote",Providence,Remote,"SQL, statistics",2026-05-29,159100.0,159100.0,NM, US,US,True,False,False
"Senior Business Analyst - HR Integration, Remote",Providence,Remote,"SQL, statistics",2026-05-29,159100.0,159100.0,TX, US,US,True,False,False
"Senior Business Analyst - HR Integration, Remote",Providence,Remote,"SQL, statistics",2026-05-29,159100.0,159100.0,Beaverton, OR,US,True,False,False
"Senior Business Analyst - HR Integration, Remote",Providence,Remote,"SQL, statistics",2026-05-29,159100.0,159100.0,OR, US,US,True,False,False
Senior Business Analyst,Ameriprise Financial,Remote,,2026-05-20,112300.0,112300.0,Charlotte, NC,US,True,False,False
Principal Product Manager - Business Intelligence & Data Products,Fanatics,Hybrid,"SQL, Tableau, Power BI, Snowflake, ETL, LLM, Agile, Scrum, business intelligence",2026-05-15,159100.0,159100.0,Atlanta, GA,US,True,False,False
Business Analyst,Edenred,On-site,"SQL, Excel, Tableau, Power BI, Looker, statistics, data visualization, data modeling",2026-05-29,159100.0,159100.0,Boston, MA,US,True,False,False
IT Business Analyst,State of Alaska,Remote,Agile,2026-05-29,159100.0,159100.0,Juneau, AK,US,True,False,False
Business Analyst - Services Delivery,Redmane Technology,Hybrid,"Excel, machine learning",2026-05-29,159100.0,159100.0,Chicago, IL,US,True,False,False
"IT Business Analyst - Morganton, NC",UNC Health,On-site,,2026-05-29,6560.0,6560.0,Morganton, NC,US,True,False,False
Business Analyst,City of Santa Clara,On-site,,2026-05-29,156716.0,156716.0,Santa Clara, CA,US,True,False,False
Senior Business Analyst,The Home Depot,On-site,"SQL, Tableau",2026-05-28,159100.0,159100.0,Atlanta, GA,US,True,False,False
Sr Business Analyst - Deposit Strategy,American National Bank of Texas,On-site,"SQL, Excel, Power BI",2026-05-23,159100.0,159100.0,Terrell, TX,US,True,False,False
"Market & Business Analyst, Prin",Halliburton,On-site,data visualization,2026-04-21,159100.0,159100.0,Spring, TX,US,True,False,False
Strategic Business Analyst,Empower Pharmacy,Remote,"SQL, Excel, Tableau, Power BI, Workday",2026-05-14,159100.0,159100.0,Houston, TX,US,True,False,False
"Manager, Business Intelligence","Core-Mark International, Inc.",On-site,"SQL, Power BI, ETL, machine learning, statistics, Agile, Scrum, data modeling, business intelligence, predictive analytics",2026-05-29,159100.0,159100.0,Westlake, TX,US,True,False,False
"Senior IT Business Analyst, Data and Analytics",Intact,Hybrid,"SQL, Snowflake, ETL, Oracle, Jira, Scrum, data modeling",2026-05-29,159100.0,159100.0,Laval, QC,US,True,False,False
"Senior IT Business Analyst, Data and Analytics",Intact,Hybrid,"SQL, Snowflake, ETL, Oracle, Jira, Scrum, data modeling",2026-05-29,159100.0,159100.0,Saint-Hyacinthe, QC,US,True,False,False
CLDRSRC9691 - ServiceNow Business Analyst - Toronto - Hybrid Contract,Cloud Resourcing,Remote,"Agile, Scrum",2026-05-29,159100.0,159100.0,Toronto, ON,US,True,False,False
"Senior Business Analyst, Data & Analytics, Data Transformation & Migration (T & I) (Telework/Hybrid)",CBC/Radio-Canada,Hybrid,"SQL, Power BI, ETL, Jira, Agile, Microsoft Fabric",2026-05-29,159100.0,159100.0,Montréal, QC,US,True,False,False
Business Analyst – Investment Banking Operations - 26-06287,NavitasPartners,On-site,"SQL, Excel, Jira, Agile, Scrum",2026-05-29,159100.0,159100.0,Laval, QC,US,True,False,False
Business Analyst,Lendable,Hybrid,"SQL, Python, machine learning",2026-05-29,159100.0,159100.0,Arlington, VA,US,True,False,False
CRM Technical Business Analyst,Canadian Cancer Society,Hybrid,"Azure, Agile, data governance",2026-05-29,159100.0,159100.0,Victoria, BC,US,True,False,False
CRM Technical Business Analyst,Canadian Cancer Society,Hybrid,"Azure, Agile, data governance",2026-05-29,159100.0,159100.0,Kelowna, BC,US,True,False,False
CRM Technical Business Analyst,Canadian Cancer Society,Hybrid,"Azure, Agile, data governance",2026-05-29,159100.0,159100.0,Ottawa, ON,US,True,False,False
CRM Technical Business Analyst,Canadian Cancer Society,Hybrid,"Azure, Agile, data governance",2026-05-29,159100.0,159100.0,Halifax, NS,US,True,False,False
"Business Intelligence Analyst, Operations",Defence Construction Canada,On-site,"Power BI, statistics, data visualization, business intelligence",2026-05-29,159100.0,159100.0,Ottawa, ON,US,True,False,False
CRM Technical Business Analyst,Canadian Cancer Society,Hybrid,"Azure, Agile, data governance",2026-05-29,159100.0,159100.0,Vancouver, BC,US,True,False,False
BI Analyst,Richelieu Hardware,On-site,"SQL, Python, Power BI, business intelligence",2026-05-29,159100.0,159100.0,Saint-Laurent, QC,US,True,False,False
"BI Developer, Data & Analytics",Giant Tiger,Remote,"SQL, Python, Looker, GCP, Google Cloud, BigQuery, Agile, business intelligence",2026-05-29,159100.0,159100.0,Ottawa, ON,US,True,False,False
Business Intelligence Analyst,GS1 Canada,On-site,"SQL, Python, Excel, Power BI, ETL, statistics, data modeling, data governance, business intelligence, forecasting",2026-05-29,159100.0,159100.0,Toronto, ON,US,True,False,False
"Senior IT Business Analyst, Data and Analytics",Intact,Hybrid,"SQL, Snowflake, ETL, Oracle, Jira, Scrum, data modeling",2026-05-29,159100.0,159100.0,Montréal, QC,US,True,False,False
"Senior IT Business Analyst, Data and Analytics",Intact,Hybrid,"SQL, Snowflake, ETL, Oracle, Jira, Scrum, data modeling",2026-05-29,159100.0,159100.0,Toronto, ON,US,True,False,False
Senior Business Analyst,RAENAN CONSULTANCY INC.,Hybrid,"Azure, Jira, Agile, Scrum, business intelligence",2026-05-29,159100.0,159100.0,Toronto, ON,US,True,False,False
IT Business Analyst,Descartes Systems Group,Remote,"Azure, Agile",2026-05-29,159100.0,159100.0,Waterloo, ON,US,True,False,False
Business Analyst – Investment Banking Operations - 26-06287,NavitasPartners,On-site,"SQL, Excel, Jira, Agile, Scrum",2026-05-29,159100.0,159100.0,Longueuil, QC,US,True,False,False
Business Analyst – Investment Banking Operations - 26-06287,NavitasPartners,On-site,"SQL, Excel, Jira, Agile, Scrum",2026-05-29,159100.0,159100.0,Montréal, QC,US,True,False,False
Business Analyst – Investment Banking Operations - 26-06287,NavitasPartners,On-site,"SQL, Excel, Jira, Agile, Scrum",2026-05-29,159100.0,159100.0,Terrebonne, QC,US,True,False,False
BUSINESS ANALYST,SOFTLINE TECHNOLOGY,On-site,"SQL, Databricks, Azure, Agile, JSON, data modeling",2026-05-29,159100.0,159100.0,Toronto, ON,US,True,False,False
ServiceNow Business Analyst - Contract,Compugen Inc,On-site,"Agile, Scrum",2026-05-29,159100.0,159100.0,Toronto, ON,US,True,False,False
Senior IT Business Analyst,Manulife,Hybrid,Agile,2026-05-29,159100.0,159100.0,Waterloo, ON,US,True,False,False
"Business Intelligence Engineer II, Talent Acquisition Analytics",Amazon.com,On-site,"SQL, Python, Excel, Tableau, ETL, AWS, statistics, Redshift, Oracle, data visualization, data modeling, business intelligence",2026-05-11,159100.0,159100.0,Vancouver, BC,US,True,False,False
Senior Business Analyst,D-Wave,On-site,"Jira, Agile",2026-05-29,159100.0,159100.0,Burnaby, BC,US,True,False,False
Senior Business Intelligence Analyst,TD,On-site,"SQL, Python, Tableau, Power BI, Databricks, Azure, machine learning, statistics, business intelligence",2026-05-29,159100.0,159100.0,Toronto, ON,US,True,False,False
Business Analyst,CIBC,Remote,Excel,2026-05-29,159100.0,159100.0,Toronto, ON,US,True,False,False
Business Intelligence Analyst (H),WATERLOO REGION DISTRICT SCHOOL BOARD,On-site,"SQL, Power BI, Agile, data visualization, data modeling, business intelligence",2026-05-29,159100.0,159100.0,Kitchener, ON,US,True,False,False
Business Intelligence Analyst Co-Op,ERCO Worldwide,On-site,"Excel, Power BI, Databricks, statistics, business intelligence",2026-05-29,159100.0,159100.0,Gatineau, QC,US,True,False,False
Human Resources Business Analyst,City of Calgary,Remote,"Azure, Jira, Agile",2026-05-28,159100.0,159100.0,Calgary, AB,US,True,False,False
Capital Markets Chief Business Analyst,National Bank of Canada,On-site,"Jira, Agile, Scrum",2026-05-27,159100.0,159100.0,Montréal, QC,US,True,False,False
Senior Business Analyst,UCLA Health,On-site,,2026-05-20,208300.0,208300.0,Los Angeles, CA,US,True,False,False
Sr. Financial Business Analyst- Onsite,Cognizant,Hybrid,Excel,2026-05-29,159100.0,159100.0,Toronto, ON,US,True,False,False
Senior Business Analyst- Financial Systems,Fernlea Flowers,On-site,"SQL, Python, Excel, Power BI, business intelligence, forecasting",2026-05-29,159100.0,159100.0,Courtland, ON,US,True,False,False
"Director, Business Intelligence & Analytics Engineering",Qcells,Remote,"SQL, Python, Tableau, Power BI, Looker, Snowflake, ETL, LLM, business intelligence",2026-05-18,159100.0,159100.0,Irvine, CA,US,True,False,False
Junior Business Analyst - ERP-2,IKO Industries,On-site,"Excel, SAP, Oracle",2026-05-27,159100.0,159100.0,Mississauga, ON,US,True,False,False
Junior Business Analyst (Jr. BA) - Student Intern,SE Health,Hybrid,"Excel, Spark",2026-05-25,159100.0,159100.0,Markham, ON,US,True,False,False
"Business Analyst, Strategy Planning and Performance (contract)",Teck Resources Limited,Hybrid,"SQL, Python, Tableau, Power BI, data modeling",2026-05-22,159100.0,159100.0,Vancouver, BC,US,True,False,False
"Business Analyst, Vendor Management Office (contract)",Teck Resources Limited,Hybrid,"SQL, Python, Tableau, Power BI, data modeling",2026-05-22,159100.0,159100.0,Vancouver, BC,US,True,False,False
Business Intelligence Analyst,NSUS Group Inc.,On-site,"SQL, Tableau, Snowflake, data visualization, business intelligence, forecasting",2026-05-29,159100.0,159100.0,Toronto, ON,US,True,False,False
Business Analyst - Financial Markets & Banking,Bank of Canada,Hybrid,"SQL, Python, R, Excel, Power BI, Databricks, Azure, Agile, Scrum, business intelligence",2026-05-28,159100.0,159100.0,Ottawa, ON,US,True,False,False
Business Intelligence Pod Lead,Lifemark Health Group,Hybrid,"Python, Power BI, Azure, Agile, data modeling, Microsoft Fabric",2026-05-28,159100.0,159100.0,North York, ON,US,True,False,False
RQ10947 - Sr. Business Analyst,Source Code,On-site,"SQL, ETL, Agile, data modeling, business intelligence",2026-05-27,159100.0,159100.0,Toronto, ON,US,True,False,False
Business Intelligence Analyst,MacLean Engineering & Marketing Co Limited,On-site,"SQL, Excel, Power BI, ETL, data modeling, business intelligence",2026-05-27,159100.0,159100.0,Collingwood, ON,US,True,False,False
RQ10948 - 2 x Sr. Business Analyst,Source Code,On-site,"SQL, ETL, Agile, data modeling, business intelligence",2026-05-27,159100.0,159100.0,Toronto, ON,US,True,False,False
Data Business Analyst (Insurance Domain),Cognizant,Hybrid,"SQL, Tableau, Power BI, Azure, Agile, data visualization, data governance",2026-05-27,159100.0,159100.0,Toronto, ON,US,True,True,False
Business Intelligence Analyst,MacLean Engineering & Marketing Co Limited,On-site,"SQL, Excel, Power BI, ETL, data modeling, business intelligence",2026-05-27,159100.0,159100.0,North Bay, ON,US,True,False,False
Business Intelligence Analyst,MacLean Engineering & Marketing Co Limited,On-site,"SQL, Excel, Power BI, ETL, data modeling, business intelligence",2026-05-27,159100.0,159100.0,Barrie, ON,US,True,False,False
Business Analyst – Supply Chain E2E Planning,ARC'TERYX,Hybrid,"ETL, Azure, SAP, Jira, Agile, data governance, forecasting",2026-05-26,159100.0,159100.0,North Vancouver, BC,US,True,True,False
Sr Data Scientist - Business Intelligence,Co-operators,Hybrid,"SQL, Python, R, Databricks, machine learning, generative AI, business intelligence",2026-05-28,159100.0,159100.0,Guelph, ON,US,True,False,False
"Senior Manager, Business Information Management and Business Intelligence Reporting",RBC,On-site,"SQL, Python, Tableau, Power BI, SAS, Hadoop, Snowflake, ETL, machine learning, statistics, data modeling",2026-05-27,159100.0,159100.0,Toronto, ON,US,True,False,False
"Analyste de données, Intelligence d'affaires/Business Intelligence Data Analyst",NEW MARKET GROUP,Hybrid,"SQL, Excel, Power BI, ETL, Azure, business intelligence",2026-01-12,159100.0,159100.0,Montréal, QC,US,True,True,True
Business Analyst (Bilingual FR/EN),BGIS,On-site,"Excel, business intelligence, Oracle",2026-01-02,159100.0,159100.0,Montréal, QC,US,True,False,False
BI Business Analyst,Belron International Limited,Hybrid,"SQL, Power BI, Snowflake, ETL, AWS, Azure, Agile, Scrum, business intelligence",2025-11-19,159100.0,159100.0,Montréal, QC,US,True,False,False
Business Analyst,RBC,On-site,"SQL, Python, Excel, machine learning, Jira, Agile",2026-05-15,159100.0,159100.0,Toronto, ON,US,True,False,False
"Responsable, intelligence d’affaires | Business Intelligence Lead",Medisca,Hybrid,"SQL, Excel, Tableau, Power BI, business intelligence",2026-03-26,159100.0,159100.0,Montréal, QC,US,True,True,False
Business Analyst on Market Data,Société Générale,Hybrid,"Python, Excel, Agile",2026-04-13,159100.0,159100.0,Montréal, QC,US,True,False,False
Technical Business Analyst,,Hybrid,"SQL, Azure, Agile, Scrum",2026-05-29,159100.0,159100.0,Pittsburgh, PA,US,True,False,False
Analyste Chaine d’Approvisionnement /Supply Chain Business Analyst,"NAOS ( Bioderma, Esthederm & État Pur)",Remote,SAP,2026-03-27,159100.0,159100.0,Montréal, QC,US,True,True,False
Business Intelligence Analyst – Supply Chain (12 months contract),Belron International Limited,Hybrid,"SQL, Excel, Power BI",2026-04-29,159100.0,159100.0,Montréal, QC,US,True,True,False
Senior Business Intelligence Engineer,"Hillwood Development Company, LLC.",On-site,"Power BI, Databricks, data modeling, data governance, business intelligence",2026-05-30,159100.0,159100.0,Dallas, TX,US,True,False,False
Product & Business Intelligence Analyst,Aylo,Hybrid,"SQL, Python, Excel, Power BI, Looker, GCP, business intelligence, data visualization",2026-03-12,159100.0,159100.0,Montréal, QC,US,True,False,False
Analyste d'Affaires SAP FICO - Business Analyst SAP FICO,Groupe Touchette Inc.,On-site,"Agile, SAP",2026-04-20,159100.0,159100.0,Saint-Laurent, QC,US,True,True,False
"Analyst, Pricing and Business Intelligence",Richelieu Hardware,On-site,"SQL, Python, Power BI, business intelligence",2026-04-16,159100.0,159100.0,Saint-Laurent, QC,US,True,False,False
Business Analyst - Internal Logistic,Bombardier,Hybrid,"Excel, SAP",2026-05-08,159100.0,159100.0,Pointe-Claire, QC,US,True,False,False
"Analyste d'affaire, Exécution de la chaîne d’approvisionnement - Business Analyst, Supply Chain Execution",Groupe Touchette Inc.,On-site,SAP,2026-05-07,159100.0,159100.0,Saint-Laurent, QC,US,True,True,False
"Manager, Business Intelligence",Mako,Remote,"Excel, Tableau, Power BI, ETL, AWS, business intelligence",2026-05-01,159100.0,159100.0,Montréal, QC,US,True,False,False
"Senior Business Analyst, eCommerce Technology (Temporary - 14 months)",ARC'TERYX,On-site,"Agile, Scrum",2026-04-22,159100.0,159100.0,North Vancouver, BC,US,True,False,False
"Business Analyst, Salesforce Marketing Cloud",ARC'TERYX,Hybrid,"Agile, Scrum",2026-04-22,159100.0,159100.0,North Vancouver, BC,US,True,False,False
Senior Business Analyst,Vancouver Fraser Port Authority,Hybrid,"Excel, Agile",2025-02-05,159100.0,159100.0,Vancouver, BC,US,True,False,False
"Analyste d’affaires – Planification de la chaîne d’approvisionnement - Business Analyst, Supply Chain transformation",Groupe Touchette Inc.,On-site,SAP,2026-05-13,159100.0,159100.0,Saint-Laurent, QC,US,True,True,False
Développeur Principal Business Intelligence (BI),Vancouver Fraser Port Authority,Hybrid,"SQL, Python, R, Azure, Agile, business intelligence",2026-04-02,159100.0,159100.0,Vancouver, BC,US,True,False,False
"Business Intelligence Engineer II, Fulfillment Optimization",Amazon.com,On-site,"SQL, Python, R, Tableau, SAS, ETL, AWS, business intelligence, data visualization, Oracle, recruiting",2026-04-01,159100.0,159100.0,Vancouver, BC,US,True,False,False
Business Analyst,Saltworks Technologies,Remote,"SQL, Python",2026-03-30,159100.0,159100.0,Richmond, BC,US,True,False,False
Senior Business Analyst,Port of Vancouver,Hybrid,"Excel, Agile",2026-03-05,159100.0,159100.0,Vancouver, BC,US,True,False,False
"Senior Consultant, Business Analyst ServiceNow",KPMG,On-site,Excel,2026-02-02,159100.0,159100.0,Vancouver, BC,US,True,False,False
Business Analyst,Westland Insurance Group,Hybrid,"SQL, Excel, business intelligence",2026-04-24,159100.0,159100.0,Surrey, BC,US,True,False,False
Power BI Developer,American business solutions inc,Remote,"SQL, Excel, Power BI, Azure, data modeling",2026-05-20,159100.0,159100.0,Denver, CO,US,True,False,False
Senior Business Analyst - Health Insurance (Fully Remote),COVERGO,Remote,"Agile, Scrum",2026-05-08,159100.0,159100.0,Vancouver, BC,US,True,False,False
Supply Chain Business Analyst,SELECT WINE MERCHANTS,Hybrid,"SQL, Excel, Tableau, Power BI, data visualization",2026-05-07,159100.0,159100.0,Vancouver, BC,US,True,True,False
Technical Business Analyst - ERP Data Migration (contract),Teck Resources Limited,Hybrid,"Excel, ETL, SAP, Oracle",2026-05-06,159100.0,159100.0,Vancouver, BC,US,True,False,False
Business Analyst and Project Support,Provincial Health Services Authority (PHSA),Remote,"SQL, Python, R",2026-05-04,159100.0,159100.0,Vancouver, BC,US,True,False,False
RQ09839 - Sr. Business Analyst,Source Code,On-site,"SQL, Excel, Agile, Scrum",2026-01-04,159100.0,159100.0,Toronto, ON,US,True,False,False
RQ09868 - Sr. Business Analyst,Source Code,On-site,Agile,2026-01-04,159100.0,159100.0,Toronto, ON,US,True,False,False
RQ09624 - Sr. Business Intelligence Specialist,Source Code,Hybrid,"SQL, AWS, Azure, business intelligence, Oracle",2026-01-04,159100.0,159100.0,Toronto, ON,US,True,False,False
Int. Business Analyst - RQ09472,Source Code,Hybrid,Oracle,2026-01-04,159100.0,159100.0,Toronto, ON,US,True,False,False
Sr. Business Analyst - RQ09425,Source Code,Hybrid,"Excel, Agile",2026-01-04,159100.0,159100.0,Toronto, ON,US,True,False,False
RQ09291 - Sr. Business Analyst,Source Code,Hybrid,"Excel, Azure, Agile, Scrum",2026-01-04,159100.0,159100.0,Toronto, ON,US,True,False,False
Graphic Design - Business Analyst,Norsat International Inc.,Remote,"Power BI, JavaScript",2026-05-14,159100.0,159100.0,Richmond, BC,US,True,False,False
RQ10406 - Business Analyst - Senior,Source Code,On-site,Agile,2026-02-12,159100.0,159100.0,Toronto, ON,US,True,False,False
RQ10171 - 3 x Sr. Business Analyst,Source Code,On-site,"Excel, Azure, Agile, Scrum",2026-02-06,159100.0,159100.0,Toronto, ON,US,True,False,False
RQ00456 - Business Analyst - Senior,Source Code,Hybrid,Azure,2026-01-04,159100.0,159100.0,Toronto, ON,US,True,False,False
RQ10029 - Business Analyst - Senior,Source Code,On-site,Agile,2026-01-04,159100.0,159100.0,Toronto, ON,US,True,False,False
RQ09962 - Sr. Business Analyst,Source Code,On-site,Agile,2026-01-04,159100.0,159100.0,Toronto, ON,US,True,False,False
Business Analyst,,On-site,"SQL, Excel, Tableau, Looker, data visualization",2026-04-17,159100.0,159100.0,San Francisco, CA,US,True,False,False
Business Analyst,PerfectVision,On-site,Excel,2026-05-29,159100.0,159100.0,Little Rock, AR,US,True,False,False
Requirements Writer / Business Analyst,Everforth ECS,On-site,"Azure, Jira",2026-05-29,159100.0,159100.0,Merrifield, VA,US,True,False,False
Business Analyst I,Kenan Advantage Group,Hybrid,"Excel, Agile, forecasting",2026-05-29,159100.0,159100.0,North Canton, OH,US,True,False,False
"Business Analyst, Senior",Global Software Resources,On-site,"Python, Excel, Power BI",2026-04-29,159100.0,159100.0,San Ramon, CA,US,True,False,False
Business Analyst III,Global Software Resources,On-site,"Excel, Power BI",2026-04-20,159100.0,159100.0,Oakland, CA,US,True,False,False
Business Analyst - Level 1,DASi LLC,On-site,Excel,2026-05-29,159100.0,159100.0,Doral, FL,US,True,False,False
Business Analyst,Fragomen,Remote,"SQL, Excel, Jira, Agile, Scrum",2026-05-29,159100.0,159100.0,Remote, US,US,True,False,False
Senior Consultant - Data Analyst/Business Analyst,Tiger Analytics,On-site,"SQL, Python, R, Tableau, machine learning",2026-05-06,159100.0,159100.0,San Francisco, CA,US,True,False,True
Consultant Business Analyst,Fidelity Investments,On-site,Jira,2026-05-29,159100.0,159100.0,Westlake, TX,US,True,False,False
Business Analyst,"Brink's, Incorporated",On-site,"SQL, Jira, Agile, Scrum",2026-05-29,159100.0,159100.0,TX, US,US,True,False,False
IT Analyst IV (Business Intelligence Report Developer),Solano County,On-site,"SQL, Tableau, Power BI, business intelligence",2026-05-05,159100.0,159100.0,Fairfield, CA,US,True,False,False
Internship: Business Intelligence,GU Energy,On-site,"SQL, Excel, ETL, business intelligence",2026-05-20,159100.0,159100.0,Berkeley, CA,US,True,False,False
Finance Business Analyst,Cognizant,Hybrid,,2026-05-29,115000.0,115000.0,Jacksonville, FL,US,True,False,False
Business Analyst,Cognizant,Hybrid,,2026-05-29,120000.0,120000.0,Jacksonville, FL,US,True,False,False
Business Analyst,WinWire,On-site,"SQL, Python, AWS, Azure, Agile, Scrum",2026-05-21,159100.0,159100.0,Foster City, CA,US,True,False,False
Business Analyst,"Control Devices, LLC",On-site,"SQL, Excel, Tableau, Power BI, business intelligence, forecasting",2026-05-29,159100.0,159100.0,Fenton, MO,US,True,False,False
"Senior Business Analyst, Technology",Raymond James,Hybrid,"SQL, Agile",2026-05-29,159100.0,159100.0,Saint Petersburg, FL,US,True,False,False
Business Intelligence Developer,Metrolina Greenhouses,Hybrid,"SQL, Power BI, SAP, data modeling, data warehousing, business intelligence",2026-05-29,159100.0,159100.0,Huntersville, NC,US,True,False,False
Business Analyst,Intone Networks,On-site,"SQL, Excel, Tableau, Agile, data visualization",2026-04-09,159100.0,159100.0,Merrimack, NH,US,True,False,False
Senior BI Analyst - IGEN,"U.S. Venture, Inc.",Hybrid,"SQL, Python, Tableau, Power BI, Looker, Snowflake, Databricks, dbt, Azure, statistics, BigQuery, Qlik, Agile, data modeling, forecasting, Synapse",2026-05-29,159100.0,159100.0,Appleton, WI,US,True,False,False
Business Analyst (Remote),FEI Systems,Hybrid,"Excel, Agile, Scrum",2026-05-29,159100.0,159100.0,Columbia, MD,US,True,False,False
Lead Business Analyst - AI Enablement & Adoption,BJ's Wholesale Club,Hybrid,,2026-04-06,181500.0,181500.0,Marlborough, MA,US,True,True,False
Business Intelligence Developer,"PHI Aviation, LLC",On-site,"SQL, Power BI, Azure, Jira, Agile, data visualization, data modeling, data governance, business intelligence, Microsoft Fabric",2026-05-29,159100.0,159100.0,Lafayette, LA,US,True,False,False
Business Analyst,Intone Networks,On-site,SQL,2026-04-20,159100.0,159100.0,Boston, MA,US,True,False,False
"Principal Business Analyst, Private Markets",Fidelity Investments,On-site,Excel,2026-04-16,159100.0,159100.0,Merrimack, NH,US,True,False,False
Database & Business Intelligence Specialist,Texas A&M University,On-site,"SQL, Power BI, data governance, business intelligence",2026-05-29,159100.0,159100.0,College Station, TX,US,True,False,False
Business Analyst with data ETL and reporting,Apollo Technology Solutions LLC,Hybrid,"Databricks, ETL, Azure, data governance, business intelligence",2026-05-29,159100.0,159100.0,Elkhart, IN,US,True,False,False
IT Business Analyst II- Finance,Firefly Aerospace,On-site,"SQL, SAP, Oracle, Jira, Agile",2026-05-29,159100.0,159100.0,Cedar Park, TX,US,True,False,False
Business Analyst,TechOp Solutions,Remote,"Jira, Agile",2026-05-29,159100.0,159100.0,Washington, DC,US,True,False,False
"Consultant, Business Analyst--Tax Exempt Market (TEM)",Fidelity Investments,On-site,Agile,2026-05-13,159100.0,159100.0,Merrimack, NH,US,True,False,False
"Consultant, Business Analyst--Tax Exempt Market (TEM)",Fidelity Investments,On-site,Agile,2026-05-13,159100.0,159100.0,Smithfield, RI,US,True,False,False
Sr. Business Intelligence Developer | Service Line Strategy Operation Analytics | Full Time,Henry Ford Health,On-site,"SQL, Excel, Tableau, Power BI, Looker, machine learning, statistics, Qlik, business intelligence",2026-05-29,159100.0,159100.0,Detroit, MI,US,True,False,False
"Enterprise Mortgage Business Analyst - Phoenix, AZ (In Office)",Zions Bancorporation,On-site,Excel,2026-05-28,159100.0,159100.0,Phoenix, AZ,US,True,False,False
Business Analyst,LTIMindtree,Remote,,2026-05-27,152798.0,152798.0,Boston, MA,US,True,False,False
Business Analyst – Data Integrity Program,State of Washington,On-site,,2026-05-18,111504.0,111504.0,Olympia, WA,US,True,False,False
Technical Business Analyst,VIM Associates,Remote,"SQL, business intelligence, SAP",2026-04-13,159100.0,159100.0,Atlanta, GA,US,True,False,False
Senior Technical Business Analyst,Shift4,On-site,"SQL, Excel, Tableau, ETL, AWS, PostgreSQL, MySQL, Agile, Scrum, business intelligence",2026-04-16,159100.0,159100.0,Atlanta, GA,US,True,False,False
Senior Technical Business Analyst,Stellantis,On-site,Agile,2026-04-15,159100.0,159100.0,Atlanta, GA,US,True,False,False
"Quantitative Business Analyst, Product Development",Intercontinental Exchange,On-site,"SQL, Python, R, Excel",2026-04-21,159100.0,159100.0,Atlanta, GA,US,True,False,False
PowerBI Developer,Intone Networks,On-site,"SQL, Python, R, Tableau, Power BI, Looker, ETL, GCP, business intelligence, data visualization, Oracle",2026-04-23,159100.0,159100.0,Atlanta, GA,US,True,False,False
Business Intelligence Analyst,Corvant,On-site,"SQL, Python, Power BI, business intelligence",2026-04-23,159100.0,159100.0,Atlanta, GA,US,True,False,False
"Dev Business Analyst, Senior",Infor,Hybrid,"Agile, Scrum, SAP, Oracle",2026-05-01,159100.0,159100.0,Atlanta, GA,US,True,False,False
Senior Technical Business Analyst,APCO Holdings,On-site,"SQL, R, Agile",2026-05-06,159100.0,159100.0,Norcross, GA,US,True,False,False
