Performance/Data Analyst III,Cornerstone Signals & Cyber Technologies,On-site,"SQL, Python, R, Tableau, Power BI, ETL, statistics, data visualization, data governance, business intelligence, predictive analytics",2026-05-25,159100.0,159100.0,Washington, DC,US,159100.0
Performance/Data Analyst I,Cornerstone Signals & Cyber Technologies,On-site,"SQL, Python, R, Excel, Tableau, Power BI, ETL, statistics, data visualization, data governance, business intelligence",2026-05-25,159100.0,159100.0,Washington, DC,US,159100.0
HR Technology and Reporting Analyst,Arlington County,Hybrid,"SQL, Oracle, data governance, business intelligence",2026-05-27,159100.0,159100.0,Arlington, VA,US,159100.0
"FM Data Analysis Specialist - McLean, VA; Must have an active TS/SCI with a Polygraph",Synertex LLC,On-site,Tableau,2026-05-26,159100.0,159100.0,McLean, VA,US,159100.0
Supply Chain Data Analyst- Secret Clearance Required,Deloitte,On-site,"SQL, Python, Snowflake, Databricks, Azure, Qlik, Git, Jira, data modeling",2026-05-27,159100.0,159100.0,Arlington, VA,US,159100.0
Data Analyst and Software Developer - Microfinance,Ontario International Development Agency,Remote,"SQL, Python, Excel, Java, Agile, Scrum",2025-12-04,159100.0,159100.0,Ottawa, ON,US,159100.0
Data Analyst,,On-site,Excel,2026-05-26,159100.0,159100.0,Arlington, VA,US,159100.0
BI Developer / Data Analyst,Kensington,Hybrid,"SQL, Power BI, business intelligence",2026-03-26,159100.0,159100.0,Toronto, ON,US,159100.0
Junior Data Analyst/BI Analyst,Alaka`ina Foundation Family of Companies,On-site,"SQL, Excel, Power BI, Databricks, ETL, Azure, Agile, data warehousing, Microsoft Fabric",2026-05-21,159100.0,159100.0,Washington, DC,US,159100.0
Business Analysis and Requirements Management,A P Ventures LLC,Remote,"SQL, Excel, statistics, Agile",2026-05-22,159100.0,159100.0,Columbia, MD,US,159100.0
ISR Data Analyst (Mid),THE GARRETT GROUP,On-site,"Python, Excel, Tableau, SAS",2026-05-22,159100.0,159100.0,Washington, DC,US,159100.0
Lead Data Analyst,Tripledot Studios,Hybrid,"SQL, Tableau, Looker",2026-03-30,159100.0,159100.0,Toronto, ON,US,159100.0
Financial Data Analyst,CALIBRE Systems,Remote,"Excel, Power BI",2026-05-21,159100.0,159100.0,Alexandria, VA,US,159100.0
Entry Level Data Analyst,"Professional Analysis, Inc",On-site,"SQL, Excel, Tableau, Power BI",2026-05-19,159100.0,159100.0,Washington, DC,US,159100.0
DATA ANALYST,Prince William County Public Schools,On-site,,2026-05-20,9280.0,9280.0,Manassas, VA,US,9280.0
Data Analyst,MetaPhase Consulting,Hybrid,"SQL, Python, Excel, Tableau, Power BI, statistics, data governance, business intelligence",2026-05-20,159100.0,159100.0,Washington, DC,US,159100.0
Performance/Data Analyst,ARDENT,On-site,"Python, R, Excel, Tableau, statistics, data visualization, data governance, predictive analytics",2026-05-20,159100.0,159100.0,Washington, DC,US,159100.0
Data Analyst,"Identity, Inc.",On-site,"Python, R, Excel, Tableau, Power BI, SPSS, statistics, data visualization",2026-05-20,159100.0,159100.0,Gaithersburg, MD,US,159100.0
Data Analyst,AXIOM BUILDERS,On-site,"SQL, Power BI",2026-04-21,159100.0,159100.0,Vancouver, BC,US,159100.0
Senior Data Analyst,Dev Technology Group,Remote,"SQL, Excel, Tableau, Power BI, Agile",2026-05-20,159100.0,159100.0,Vienna, VA,US,159100.0
Senior Data Analyst,"The Cadmus Group, Inc.",On-site,"SQL, Python, Excel, Tableau, SAS, Snowflake, MongoDB, Jira, Agile, data governance, business intelligence",2026-04-09,159100.0,159100.0,McLean, VA,US,159100.0
Revenue Integrity Data Analyst I (Hybrid),University of Maryland Medical System,On-site,Excel,2026-05-19,159100.0,159100.0,Linthicum Heights, MD,US,159100.0
Senior Safety and Occupational Health (SOH) Data Analyst,Concurrent Technologies Corporation,Remote,"SQL, Excel, Tableau, statistics, data governance",2026-05-01,159100.0,159100.0,Arlington, VA,US,159100.0
Data Analyst,"Systems Planning and Analysis, Inc. (SPA)",Hybrid,"R, Tableau, Power BI",2026-04-23,159100.0,159100.0,Springfield, VA,US,159100.0
Data Analyst,Partify Inc.,On-site,"SQL, Python, R, Excel, Tableau, Power BI, Looker, Google Cloud, statistics, business intelligence, forecasting",2026-05-23,159100.0,159100.0,Warren, MI,US,159100.0
Data Analysis Intern (Yearlong),Aumovio,On-site,Excel,2026-05-21,159100.0,159100.0,Auburn Hills, MI,US,159100.0
Reporting & Analysis Specialist,MSX International,Hybrid,"SQL, Excel, Tableau, ETL, statistics, Alteryx, data visualization, business intelligence",2026-05-28,159100.0,159100.0,Troy, MI,US,159100.0
Data & Reporting Analyst,Epic Health System,On-site,Excel,2026-05-06,159100.0,159100.0,Southfield, MI,US,159100.0
Business & Data Analyst,Stellantis,On-site,Agile,2026-04-30,159100.0,159100.0,Auburn Hills, MI,US,159100.0
Sr. Data Analyst-Materials Management,ZF,On-site,"Excel, SAP",2026-04-30,159100.0,159100.0,Farmington Hills, MI,US,159100.0
Senior Data Analyst,Allegis Global Solutions,On-site,"Excel, Power BI, SAP, data governance",2026-04-28,159100.0,159100.0,Troy, MI,US,159100.0
Procurement Data Analyst,Sun Communities,On-site,"SQL, Python, Excel, Tableau, Power BI, SAP, Oracle, data modeling, data governance",2026-04-27,159100.0,159100.0,Southfield, MI,US,159100.0
Dealer Audit - Data Analyst & AI Solutions,Stellantis,On-site,data governance,2026-04-24,159100.0,159100.0,Auburn Hills, MI,US,159100.0
Government Investigations and Takata Data Analyst,Stellantis,On-site,data governance,2026-04-22,159100.0,159100.0,Auburn Hills, MI,US,159100.0
Warranty Data Analyst / Data Scientist,Stellantis,On-site,"machine learning, predictive analytics",2026-04-22,159100.0,159100.0,Auburn Hills, MI,US,159100.0
ICT AI Business Analyst/Data Analyst,Stellantis,On-site,"SQL, Python, R, Tableau, Power BI, AWS, Azure, GCP, generative AI, Agile",2026-04-16,159100.0,159100.0,Auburn Hills, MI,US,159100.0
SR Data Analyst with Insurance Domain,Cognizant,Hybrid,"Python, Excel, AWS, data warehousing",2026-05-27,159100.0,159100.0,Charlotte, NC,US,159100.0
Business Data Analyst,United Utility,On-site,"Excel, Power BI",2026-05-20,159100.0,159100.0,Charlotte, NC,US,159100.0
Data Analyst - Loan Boarding,Two Harbors Investment Corp.,On-site,"SQL, Excel, ETL",2026-04-30,159100.0,159100.0,Fort Mill, SC,US,159100.0
Data Analyst (Charitable Giving Department),"Coca-Cola Consolidated, Inc.",Remote,"Excel, Tableau",2026-05-13,159100.0,159100.0,Charlotte, NC,US,159100.0
Data Analyst-Tech Con-Data & Analytics-DG & C - FSO - Senior- Multiple Positions-1707959,EY,Hybrid,"SQL, Spark, Hadoop, Snowflake, Databricks, AWS, Azure, statistics, PostgreSQL, MySQL, MongoDB, Redshift, Oracle, data governance",2026-05-07,159100.0,159100.0,Charlotte, NC,US,159100.0
Senior Data Analyst,Flow Control Group,On-site,"SQL, Tableau, Power BI, Snowflake, Qlik, SAP, data modeling, data warehousing, data governance, business intelligence",2026-05-07,159100.0,159100.0,Charlotte, NC,US,159100.0
Master Data Analyst,SYNTEGON,On-site,"Excel, Tableau, Power BI, SAP, data visualization, data modeling, data governance, business intelligence",2026-05-29,159100.0,159100.0,New Richmond, WI,US,159100.0
"Senior Associate, Data Analyst",Capital One,Hybrid,"SQL, Python, Tableau, Snowflake, AWS, PostgreSQL, MySQL, data visualization, Oracle, Linux, recruiting",2026-01-19,159100.0,159100.0,Toronto, ON,US,159100.0
Data Analyst,Zimmerman Reed,Hybrid,"SQL, Excel, Tableau, Power BI, statistics",2026-05-27,159100.0,159100.0,Minneapolis, MN,US,159100.0
Data Analyst / Consultant (Fire / EMS),Darkhorse Emergency,Remote,"SQL, Python, Excel, data visualization",2026-03-25,159100.0,159100.0,Remote, CA,US,159100.0
Data Analyst / Consultant (Fire / EMS),Darkhorse Emergency,Remote,"SQL, Python, Excel, data visualization",2026-03-25,159100.0,159100.0,Edmonton, AB,US,159100.0
"Data Analyst, Information Technology",CPSBC Careers,Hybrid,"SQL, Excel, Tableau, Power BI, cybersecurity",2026-03-30,159100.0,159100.0,Vancouver, BC,US,159100.0
Market Data Analyst,Manulife,Hybrid,"Excel, Power BI, data visualization",2026-03-19,159100.0,159100.0,Toronto, ON,US,159100.0
"Manager, Corporate Strategy Analysis",Capital One,Hybrid,recruiting,2026-04-13,159100.0,159100.0,Toronto, ON,US,159100.0
"Senior Data Analyst, Core",Match Group,On-site,"SQL, Tableau, Looker, Databricks",2026-04-13,159100.0,159100.0,Vancouver, BC,US,159100.0
Senior Data Analyst- BigQuery and SQL Server,Ford Motor Company,Hybrid,"SQL, Python, R, Power BI, Looker, GCP",2026-04-21,159100.0,159100.0,Waterloo, ON,US,159100.0
Senior Data Analyst,NIKE,Remote,"SQL, Python, R, Tableau, Power BI, Spark, Snowflake, Databricks, ETL, AWS, Azure, Alteryx, Jira, Agile, Scrum, REST API, Airflow",2026-05-28,159100.0,159100.0,Beaverton, OR,US,159100.0
Master Data Analyst,Applied Industrial Technologies,On-site,"SAP, data governance",2026-05-27,159100.0,159100.0,Sherwood, OR,US,159100.0
"Senior Data Analyst, BI & Analytics",PayRange,On-site,"SQL, Python, Tableau, dbt, AWS, BigQuery, Git, data governance, business intelligence, Airflow",2026-05-21,159100.0,159100.0,Portland, OR,US,159100.0
Operations Data and Reporting Analyst,Willamette Dental,On-site,,2026-05-20,76000.0,76000.0,Hillsboro, OR,US,76000.0
Communications and Data Analyst,Everforth ECS,On-site,Excel,2026-05-19,159100.0,159100.0,Portland, OR,US,159100.0
Market Research & Data Analyst (Entry Level),Amrize,On-site,recruiting,2026-05-14,159100.0,159100.0,Calgary, AB,US,159100.0
Data Analyst,American Power and Gas,On-site,"SQL, Excel, Tableau, Power BI, Looker, statistics, data visualization",2026-05-14,159100.0,159100.0,Seminole, FL,US,159100.0
Financial Reporting Analyst,,On-site,"Excel, Power BI",2026-05-07,159100.0,159100.0,Sarasota, FL,US,159100.0
JOC IM Data Analyst,BlueWater Federal Solutions,On-site,Power BI,2026-05-22,159100.0,159100.0,Tampa, FL,US,159100.0
Commodity & Data Analyst Intern,Safran,Hybrid,"Excel, SAP",2026-04-29,159100.0,159100.0,Sarasota, FL,US,159100.0
HR Data Analyst,Bloomin' Brands,Remote,Excel,2026-05-15,159100.0,159100.0,Tampa, FL,US,159100.0
Business Analytics and Recognition Data Analyst,Holland & Knight,On-site,"Excel, Power BI, data visualization, data governance",2026-04-17,159100.0,159100.0,Brandon, FL,US,159100.0
Data Analyst,Fintech,On-site,"SQL, data governance",2026-04-14,159100.0,159100.0,Tampa, FL,US,159100.0
Budget and Data Analyst,"Polk County, FL",On-site,"Excel, Oracle, forecasting",2026-05-04,159100.0,159100.0,Bartow, FL,US,159100.0
Personal Lines Data Analyst (Hybrid Work Model),Sentry,Hybrid,"SQL, predictive analytics",2026-05-28,159100.0,159100.0,Nashville, TN,US,159100.0
Senior Data Analyst,"EnableComp, LLC",Remote,"SQL, Tableau, Power BI, Qlik",2026-05-18,159100.0,159100.0,Franklin, TN,US,159100.0
"Senior Data Analyst, RCM",Akumin,Remote,"SQL, Excel, predictive analytics",2026-05-14,159100.0,159100.0,Nashville, TN,US,159100.0
Data Analyst,Altair Data Resources,On-site,"SQL, Python, R, Excel, Tableau, Power BI, SAS, SPSS, ETL, statistics, Alteryx",2026-05-21,159100.0,159100.0,Brentwood, TN,US,159100.0
Master Data Analyst – Finance,Schneider Electric,On-site,"SQL, Excel, ETL, SAP, Agile, Scrum",2026-05-05,159100.0,159100.0,Nashville, TN,US,159100.0
Data Reporting Analyst,Pick Your Part,On-site,"Excel, Tableau, Power BI, Qlik",2026-04-23,159100.0,159100.0,Brentwood, TN,US,159100.0
"Manager, Financial Planning & Analysis",PetroChina Canada,On-site,"SAP, recruiting",2026-05-28,159100.0,159100.0,Calgary, AB,US,159100.0
"VP Financial Planning, Analysis & Reporting",Goway Travel,Remote,"Tableau, Power BI",2026-05-29,159100.0,159100.0,Toronto, ON,US,159100.0
"Manager, Quantitative Analysis and Strategy",BMO Financial Group,On-site,"SQL, Python, Power BI, machine learning, recruiting",2026-05-29,159100.0,159100.0,Toronto, ON,US,159100.0
Lead Data analyst,VeeRteq Solutions Inc.,Hybrid,"SQL, Python, Agile, networking",2025-12-09,159100.0,159100.0,Calgary, AB,US,159100.0
Data Analyst,Initiate,Remote,"SQL, Python, Power BI, Snowflake, Databricks",2026-02-26,159100.0,159100.0,Toronto, ON,US,159100.0
"Sr. Manager, Financial Planning & Analysis",Comcast,On-site,"Oracle, forecasting",2026-05-14,159100.0,159100.0,Philadelphia, PA,US,159100.0
Financial Analysis Senior Associate - Card Pricing,JPMorganChase,On-site,"Excel, Tableau, machine learning, Alteryx, data visualization, data governance, forecasting",2026-05-13,159100.0,159100.0,Wilmington, DE,US,159100.0
Alternative Investments Client Reporting Analyst,JPMorganChase,On-site,Excel,2026-05-16,159100.0,159100.0,Newark, DE,US,159100.0
"Manager, Financial Planning & Analysis",Texas Water,On-site,forecasting,2026-04-27,159100.0,159100.0,New Braunfels, TX,US,159100.0
Data Analysis Manager - Consumer Banking,Frost,On-site,"SQL, Python, Tableau, data visualization",2026-05-07,159100.0,159100.0,San Antonio, TX,US,159100.0
Senior Compliance Reporting Analyst,Banner Bank,On-site,"Power BI, data governance",2026-04-28,159100.0,159100.0,Carlsbad, CA,US,159100.0
Senior Financial Reporting Analyst,CS Disco,On-site,Excel,2026-05-06,159100.0,159100.0,Austin, TX,US,159100.0
Readiness Data Analyst – Systems Analyst II,VTG Defense,On-site,"Excel, Tableau",2024-05-17,159100.0,159100.0,California, MD,US,159100.0
Senior Financial Reporting Analyst,GROUNDFLOOR Finance,Remote,Excel,2026-05-11,159100.0,159100.0,Atlanta, GA,US,159100.0
"Analyst 2, Forecasting & Analysis",Comcast,On-site,,2026-05-28,92526.0,92526.0,Philadelphia, PA,US,92526.0
"Senior Analyst, Corporate Planning & Analysis",Royal Caribbean Group,On-site,"Excel, Oracle, forecasting",2026-04-20,159100.0,159100.0,Miami, FL,US,159100.0
Senior Analyst Financial Planning and Analysis,NSF International,On-site,Excel,2026-05-08,159100.0,159100.0,Ann Arbor, MI,US,159100.0
Financial Planning & Analysis Manager,Priority Waste,On-site,"Excel, Tableau, Power BI, SAP, Oracle, forecasting",2026-04-30,159100.0,159100.0,Clinton Township, MI,US,159100.0
Senior Financial Planning & Analysis Analyst,Lineage,On-site,"Excel, data visualization, forecasting",2026-04-30,159100.0,159100.0,Novi, MI,US,159100.0
"Analyst, Financial Planning & Analysis",PHINIA,On-site,"Excel, Agile, forecasting",2026-04-17,159100.0,159100.0,Auburn Hills, MI,US,159100.0
"Sr. Director, Financial Planning & Analysis (FP&A)",WebFX,Hybrid,"Excel, Looker",2026-04-08,159100.0,159100.0,Ann Arbor, MI,US,159100.0
Financial Planning and Analysis Director,CPI Security,On-site,"SQL, Excel, Tableau, Power BI, forecasting",2026-05-20,159100.0,159100.0,Charlotte, NC,US,159100.0
Behavior Analysis Practicum (Master's Level),Action Behavior Centers - ABA Therapy for Autism,On-site,,2026-05-11,4800.0,4800.0,Concord, NC,US,4800.0
Behavior Analysis Practicum (Master's Level),Action Behavior Centers - ABA Therapy for Autism,On-site,,2026-05-11,4800.0,4800.0,Charlotte, NC,US,4800.0
Behavior Analysis Practicum (Master's Level),Action Behavior Centers - ABA Therapy for Autism,On-site,,2026-05-11,4800.0,4800.0,Steele Creek, NC,US,4800.0
Behavior Analysis Practicum (Master's Level),Action Behavior Centers - ABA Therapy for Autism,On-site,,2026-05-11,4800.0,4800.0,Pineville, NC,US,4800.0
Behavior Analysis Practicum (Master's Level),Action Behavior Centers - ABA Therapy for Autism,On-site,,2026-05-11,4800.0,4800.0,Indian Trail, NC,US,4800.0
Behavior Analysis Practicum (Master's Level),Action Behavior Centers - ABA Therapy for Autism,On-site,,2026-05-11,4800.0,4800.0,Belmont, NC,US,4800.0
Behavior Analysis Practicum (Master's Level),Action Behavior Centers - ABA Therapy for Autism,On-site,,2026-05-11,4800.0,4800.0,Mooresville, NC,US,4800.0
Quality Data Analyst,Yulista Management Services,On-site,"SQL, Excel, Power BI, business intelligence, recruiting",2026-05-28,159100.0,159100.0,Huntsville, AL,US,159100.0
Senior Financial Planning & Analysis Analyst,US Conec,On-site,"Excel, business intelligence, forecasting",2026-05-07,159100.0,159100.0,Hickory, NC,US,159100.0
Analyst - FP&A (Financial Planning and Analysis),Onward Energy,On-site,"Excel, SAP, forecasting",2026-04-23,159100.0,159100.0,Charlotte, NC,US,159100.0
Digital Data Analyst,,Remote,"SQL, Tableau, Power BI, Looker",2026-05-21,159100.0,159100.0,Remote, US,US,159100.0
Principal Technical Data Analyst,American Modern Insurance Group,Hybrid,"SQL, Python, R, Power BI, Databricks, AWS, Azure, Agile, business intelligence",2026-05-22,159100.0,159100.0,Amelia, OH,US,159100.0
Registered Behavior Technician (RBT) or Registered Behavior Analysis Interventionist - Clinic,SUNBEAM ABA CENTER,On-site,,2026-05-02,4160.0,4160.0,Oregon City, OR,US,4160.0
BI Developer / Data Analyst,Eye Health America,On-site,"SQL, Tableau, Power BI, ETL, business intelligence",2026-05-28,159100.0,159100.0,Greenville, SC,US,159100.0
Senior Business Planning Analyst - Financial Planning & Analysis (FP&A),Tampa Electric Company,Remote,"Excel, Tableau, Power BI, SAP, data visualization, forecasting",2026-05-26,159100.0,159100.0,Tampa, FL,US,159100.0
Financial Planning & Analysis Specialist,Climate First Bank,Remote,"Excel, forecasting",2026-05-01,159100.0,159100.0,Saint Petersburg, FL,US,159100.0
"Mgr, Ops Planning & Analysis",Tractor Supply,On-site,"SQL, Python, Excel, statistics, Alteryx, data governance",2026-05-04,159100.0,159100.0,Brentwood, TN,US,159100.0
Director Clinical Resource Analysis,HealthTrust,On-site,"Excel, Tableau, Power BI",2026-05-30,159100.0,159100.0,Nashville, TN,US,159100.0
"Sr. Analyst, Financial Planning & Analysis",Comcast,On-site,forecasting,2026-04-01,159100.0,159100.0,Philadelphia, PA,US,159100.0
"Data Scientist – Private Equity, Private Credit Risk, & Performance Analysis",GXM Technologies LLC,On-site,"Tableau, Power BI, machine learning, statistics, predictive analytics, forecasting",2026-05-20,159100.0,159100.0,Washington, DC,US,159100.0
"Domestic Customer Support Analyst (Business Analysis, Junior Analyst)",The MIL Corporation,On-site,,2026-05-12,80000.0,80000.0,Washington, DC,US,80000.0
"Modeling, Simulation and Analysis Engineer (Senior-Level) TO 11 / 203 PD 5b",Mission Intel,Hybrid,machine learning,2026-05-07,159100.0,159100.0,Springfield, VA,US,159100.0
"Modeling, Simulation and Analysis Engineer (Senior-Level) #788",Allen Integrated Solutions,Hybrid,machine learning,2026-05-08,159100.0,159100.0,Springfield, VA,US,159100.0
"Modeling, Simulation and Analysis Engineer Senior Level","Integrity Technology Consultants, Inc.",Hybrid,machine learning,2026-05-07,159100.0,159100.0,Chantilly, VA,US,159100.0
"Modeling, Simulation & Analysis Engineer - Senior - TO11 Pos.203",Integrated Intel Solutions,Hybrid,machine learning,2026-05-06,159100.0,159100.0,Chantilly, VA,US,159100.0
"Data Analyst, DOC",The Fortune Society,Remote,"Excel, statistics, forecasting",2026-05-12,159100.0,159100.0,Long Island City, NY,US,159100.0
"Data Analyst (Power Control Center), Emerging Talent Intern (Fall)",Metropolitan Transportation Authority,On-site,Power BI,2026-05-12,159100.0,159100.0,New York, NY,US,159100.0
"Data Analyst, Emerging Talent Intern (Fall)",Metropolitan Transportation Authority,On-site,"Excel, Power BI, data visualization",2026-05-12,159100.0,159100.0,New York, NY,US,159100.0
Senior Business Analysis Specialist - Aerospace,PPG,Hybrid,Agile,2026-04-03,159100.0,159100.0,Sylmar, CA,US,159100.0
"SAP iXp Intern - Data Analysis, Comms & Project Management Services Sales",SAP,Hybrid,"Excel, SAP, data visualization",2026-05-21,159100.0,159100.0,Newtown Square, PA,US,159100.0
Data Analyst-Tech Con-Data and Analytics-Data Arch and Eng-FSO-Manager-Multiple Positions-1707627,EY,Hybrid,"SQL, Spark, Snowflake, Databricks, AWS, Azure, GCP, Kubernetes, statistics, PostgreSQL, MySQL, MongoDB, Redshift, Oracle, data modeling, data warehousing, Synapse, Kafka",2026-05-05,159100.0,159100.0,Philadelphia, PA,US,159100.0
Technical Business Analysis - Advisor I,Fiserv,On-site,"A/B testing, Jira, Agile, Scrum",2026-04-21,159100.0,159100.0,King of Prussia, PA,US,159100.0
Global Workforce Screening Associate - Business Analysis & Reporting Specialist,JPMorganChase,On-site,Alteryx,2026-04-29,159100.0,159100.0,Plano, TX,US,159100.0
LP Systems and Data Analyst,Sally Beauty,Hybrid,"Excel, Jira, Agile",2026-04-08,159100.0,159100.0,Plano, TX,US,159100.0
"Student Research Assistant, Social Media Analysis, Roy EDAP 2026",New College of Florida,On-site,"Python, machine learning, JSON",2026-05-06,159100.0,159100.0,Sarasota, FL,US,159100.0
Digital Data Analyst,"ECU Communications, LLC",On-site,"SQL, Python, R, Excel, Tableau, Power BI, Looker, statistics, A/B testing, forecasting",2026-05-18,159100.0,159100.0,Washington, DC,US,159100.0
Data Analyst,Analytic Services Inc,On-site,"SQL, Python, Tableau, Databricks, ETL, Qlik, Java, business intelligence",2026-05-18,159100.0,159100.0,Alexandria, VA,US,159100.0
Data Analyst Senior – TS/SCI with CI Poly,Xcelerate Solutions,On-site,"Excel, Tableau, SPSS, LLM, data visualization",2026-05-15,159100.0,159100.0,McLean, VA,US,159100.0
"Data Analyst, Lead",Redwire Space,On-site,"data governance, business intelligence",2026-05-15,159100.0,159100.0,Chantilly, VA,US,159100.0
Data Analyst - TC - Data & Analytics - Data Arch & Eng - FSO - Manager - Mul Pos - 1699535,EY,Hybrid,"SQL, Spark, Snowflake, Databricks, AWS, Azure, GCP, Kubernetes, statistics, PostgreSQL, MySQL, MongoDB, Redshift, Oracle, data modeling, data warehousing, Synapse, Kafka",2026-04-07,159100.0,159100.0,Charlotte, NC,US,159100.0
"Senior Manager, Business System Analysis - Remote",Optum,Remote,,2026-05-22,193200.0,193200.0,Eden Prairie, MN,US,193200.0
Business Analysis Manager - Global Screening Operations - Vice President,JPMorganChase,On-site,Agile,2026-04-29,159100.0,159100.0,Tampa, FL,US,159100.0
"Analyst, Loss Analysis",Freedom Mortgage,Remote,Excel,2026-05-26,159100.0,159100.0,Marlton, NJ,US,159100.0
Financial Reporting Analyst III,Chesapeake Utilities Corporation,Hybrid,Excel,2026-05-27,159100.0,159100.0,Newark, DE,US,159100.0
Financial Reporting Analyst II,Chesapeake Utilities Corporation,Hybrid,Excel,2026-05-27,159100.0,159100.0,Newark, DE,US,159100.0
Lead Data Scientist/Data Analyst,"KALMAN & COMPANY, INC.",On-site,"SQL, Python, R, Excel, Power BI, Spark, Databricks, scikit-learn, machine learning, NLP, statistics, Java, Scala, Agile, data visualization, business intelligence",2026-05-11,159100.0,159100.0,Stafford, VA,US,159100.0
External SEC Reporting Analyst,Corteva Agriscience,On-site,Excel,2026-05-14,159100.0,159100.0,Wilmington, DE,US,159100.0
Data Analyst Director,Community Bible Church,On-site,"data visualization, business intelligence",2026-04-27,159100.0,159100.0,San Antonio, TX,US,159100.0
Senior Data Analyst - Subject Matter Expert (SME),AGE Solutions,On-site,"SQL, Python, R, Excel, Tableau, Power BI, SAS, ETL, machine learning, statistics, data visualization, data warehousing, data governance, business intelligence, predictive analytics, forecasting",2026-05-06,159100.0,159100.0,Fort Meade, MD,US,159100.0
Human Resources Data Analyst,A P Ventures LLC,Remote,"SQL, Python, R, Excel, Tableau, Power BI, machine learning, statistics, Agile, data visualization, business intelligence",2026-05-06,159100.0,159100.0,Columbia, MD,US,159100.0
Economic Trade Data Analyst - DOC BIS (Hybrid),BluePath Labs,Hybrid,"SQL, Python, Snowflake, machine learning, statistics, data visualization",2026-05-04,159100.0,159100.0,Washington, DC,US,159100.0
Reg Fin Plan & Analysis Dir-FG,Forestar Group,On-site,"R, Excel, forecasting",2026-05-19,159100.0,159100.0,Austin, TX,US,159100.0
"Manager, Orbital Analysis",Slingshot Aerospace,Remote,,2026-05-18,165000.0,165000.0,Denver, CO,US,165000.0
"Analyst, Financial Planning & Analysis","Avelo Airlines, Inc.",On-site,forecasting,2026-04-23,159100.0,159100.0,Houston, TX,US,159100.0
Senior Financial Reporting Analyst,microvast,On-site,"Excel, SAP",2026-04-13,159100.0,159100.0,Houston, TX,US,159100.0
Project Delivery Manager – 1898 & Co. – Transmission Planning & Power System Analysis (Southwest Region - Phoenix),Burns & McDonnell,On-site,Excel,2026-05-20,159100.0,159100.0,Phoenix, AZ,US,159100.0
Financial Planning & Analysis Analyst,Ascent Aerospace,On-site,"Excel, SAP, forecasting",2026-05-27,159100.0,159100.0,Macomb, MI,US,159100.0
"Supervisor, Lease Analysis",Kimco Realty Corporation,On-site,R,2026-05-04,159100.0,159100.0,Charlotte, NC,US,159100.0
"Manager, Financial Planning and Analysis",WellDyne,On-site,"SQL, Excel, Tableau, Power BI, forecasting",2026-05-13,159100.0,159100.0,Lakeland, FL,US,159100.0
"Sr Analyst, Regional Financial Planning and Analysis",Coke Florida,On-site,"Excel, forecasting",2026-05-18,159100.0,159100.0,Tampa, FL,US,159100.0
Region Director Financial Planning & Analysis,Ardent Health Services,On-site,forecasting,2026-05-21,159100.0,159100.0,Brentwood, TN,US,159100.0
Financial Planning & Analysis Analyst - Hybrid,Surgery Partners,Hybrid,forecasting,2026-04-03,159100.0,159100.0,Nashville, TN,US,159100.0
Director of Financial Planning and Analysis,Harvard University,Remote,"Excel, forecasting",2026-05-14,159100.0,159100.0,Boston, MA,US,159100.0
Fin Planning and Analysis Analyst II,"Coca-Cola Consolidated, Inc.",On-site,"Excel, forecasting",2026-05-27,159100.0,159100.0,Charlotte, NC,US,159100.0
Software Data Analyst,Ameresco,On-site,Excel,2026-05-14,159100.0,159100.0,Calgary, AB,US,159100.0
Senior Data Analyst,Bird Construction,Hybrid,"SQL, Power BI, Databricks, Agile, data governance, business intelligence, Microsoft Fabric, Synapse",2026-04-22,159100.0,159100.0,Calgary, AB,US,159100.0
Property Data Analyst,Onward Homes,On-site,Excel,2026-04-15,159100.0,159100.0,Calgary, AB,US,159100.0
"Data Analyst, Settlement Platforms",Digital Commerce Bank,On-site,"SQL, Python, Excel, statistics",2026-05-08,159100.0,159100.0,Calgary, AB,US,159100.0
Accounting/Reporting Analyst (Contract),BGIS,Hybrid,"R, Excel",2026-05-15,159100.0,159100.0,Ottawa, ON,US,159100.0
Senior Data Analyst,Price Industries Limited,On-site,"SQL, Excel, Power BI, data modeling",2026-04-07,159100.0,159100.0,Winnipeg, MB,US,159100.0
