Cost Engineer/Data Analyst (TS clearance required),Lockheed Martin,Remote,"SQL, Python, Tableau, statistics, predictive analytics, forecasting",2026-05-13,208150.0,208150.0,Littleton, CO,US,208150.0
Operational Data Analyst,Capgemini,On-site,"Excel, Jira, data visualization, data governance",2026-05-13,8000.0,8000.0,Denver, CO,US,8000.0
"(USA) Senior, Data Analyst",Walmart,On-site,"SQL, Python, R, Tableau, Power BI, Spark, ETL, statistics, Scala, data visualization, business intelligence",2026-05-20,171000.0,171000.0,Denver, CO,US,171000.0
Revenue Operations Data Analyst,InnovAge,Remote,"Excel, Power BI, ETL, Azure, A/B testing, data modeling, business intelligence, forecasting",2026-05-19,130000.0,130000.0,Denver, CO,US,130000.0
Commercial Data Analyst,Leiters,Hybrid,"Excel, Power BI",2026-05-28,91908.0,91908.0,Englewood, CO,US,91908.0
Strategic Sourcing Data Analyst,CRUSOE,On-site,"SQL, Python, R, Tableau, Power BI, generative AI, LLM, SAP, Jira",2026-05-27,100000.0,100000.0,Denver, CO,US,100000.0
"Sr. Data Analyst, Quality",Precor,On-site,"SQL, Python, R, Tableau, Power BI, statistics, SAP, data visualization",2026-04-06,169000.0,169000.0,Woodinville, WA,US,169000.0
"TikTok Shop - Strategy & Data Analyst, E-Commerce",TikTok,On-site,"SQL, Python",2026-04-01,209380.0,209380.0,Seattle, WA,US,209380.0
Senior Data Analyst,MacroHealth,Remote,"SQL, Python, Tableau, Spark, Databricks",2026-04-15,145000.0,145000.0,Kirkland, WA,US,145000.0
"Clinical Data Analyst, Spotfire",Systimmune,On-site,"SQL, R, Excel, SAS, GCP, Oracle, data visualization",2026-04-13,130000.0,130000.0,Redmond, WA,US,130000.0
"Senior Data and Reporting Analyst, Total Rewards",CRUSOE,On-site,"SQL, Python, R, Excel, Tableau, Power BI, Looker, LLM, forecasting",2026-04-13,145000.0,145000.0,Seattle, WA,US,145000.0
Partner Data Analyst,Truveta,Hybrid,"SQL, Python, R, Excel, Spark",2026-04-11,120000.0,120000.0,Seattle, WA,US,120000.0
Healthcare Data Analyst II,Premera Blue Cross,Hybrid,"SQL, Python, Excel, SAS, statistics, business intelligence",2026-04-24,130200.0,130200.0,Mountlake Terrace, WA,US,130200.0
"Data Analyst, RCX",Amazon.com,On-site,"SQL, R, Excel, Agile",2026-04-21,6880.0,6880.0,Bellevue, WA,US,6880.0
Data Analyst II - User Engagement & Conversion,Rocket,On-site,"SQL, Python, R, Excel, Tableau, Snowflake, statistics",2026-05-03,135400.0,135400.0,Seattle, WA,US,135400.0
Data Analyst II - Inventory & SEO Growth,Rocket,On-site,"SQL, Python, R, Excel, Tableau, Snowflake, statistics",2026-05-03,135400.0,135400.0,Seattle, WA,US,135400.0
"Data Analyst 2: Inventory (Hybrid - Seattle, WA)",Nordstrom,On-site,"SQL, Python, R, Tableau, Power BI, ETL, AWS, GCP, statistics, Alteryx, Git, data visualization, data modeling, data warehousing",2026-04-29,145500.0,145500.0,Seattle, WA,US,145500.0
Azure BI Data Analyst,Tata Consultancy Services (TCS),On-site,"SQL, Python, Power BI, Databricks, Azure, forecasting",2026-05-11,101000.0,101000.0,Bellevue, WA,US,101000.0
Senior Research & Data Analyst,NWCCU,Hybrid,"SQL, Python, Tableau, Power BI, statistics, Java, data visualization, data warehousing, data governance",2026-05-11,120000.0,120000.0,Redmond, WA,US,120000.0
Data Analyst - Housing Programs,DESC,Hybrid,"SQL, Python, R, Excel",2026-05-08,100846.0,100846.0,Seattle, WA,US,100846.0
Business and Data Analyst,Tata Consultancy Services (TCS),On-site,"SQL, Databricks, Azure, Agile, Scrum, data governance, business intelligence",2026-05-19,120000.0,120000.0,Seattle, WA,US,120000.0
Data Analyst - Asset Reporting,Costco Wholesale,On-site,"SQL, Power BI, data governance, business intelligence",2026-05-18,7680.0,7680.0,Seattle, WA,US,7680.0
Behavioral Health Fiscal Information and Data Analyst (WMS2/FS),State of Washington,On-site,forecasting,2026-05-15,111648.0,111648.0,Olympia, WA,US,111648.0
Behavioral Health Fiscal Information and Data Analyst (WMS2/FS),Washington State Health Care Authority,On-site,"SQL, Excel, forecasting",2026-05-15,111648.0,111648.0,Olympia, WA,US,111648.0
Senior People Analytics Data Analyst,Blue Origin,On-site,"SQL, Python, R, Tableau, data visualization, data governance, business intelligence",2026-05-14,188207.0,188207.0,Seattle, WA,US,188207.0
Data Analyst,magniX USA Inc,On-site,"Power BI, SAP, data modeling, business intelligence",2026-05-21,130000.0,130000.0,Everett, WA,US,130000.0
Data Analyst | Management Analyst 4,State of Washington,Remote,"SQL, Excel, Power BI, Azure, statistics, Git, Agile",2026-05-27,113184.0,113184.0,Tumwater, WA,US,113184.0
Senior Data Analyst,Adaptive Biotechnologies,Hybrid,"SQL, Python, R, Excel, Tableau, ETL, statistics, data visualization, data governance",2026-05-28,135000.0,135000.0,Seattle, WA,US,135000.0
"Senior Data Analyst II, Product",MongoDB,Hybrid,"SQL, Python, R, AWS, Azure, Google Cloud, MongoDB",2026-04-24,189000.0,189000.0,Austin, TX,US,189000.0
Comptroller- SDPVS Data Analyst,Texas Comptroller of Public Accounts,Hybrid,Excel,2026-05-12,63000.0,63000.0,Austin, TX,US,63000.0
Development Data Analyst Lead,Caritas of Austin,Hybrid,Excel,2026-05-07,60000.0,60000.0,Austin, TX,US,60000.0
Data Analyst V,Texas Health and Human Services Commission,On-site,"SQL, Python, R, Excel, SAS, statistics",2026-05-21,129420.0,129420.0,Austin, TX,US,129420.0
Data Analyst,CharterUp,Hybrid,"SQL, Python, Excel, Tableau, Power BI, Snowflake, dbt, statistics, Redshift, data visualization, business intelligence, Fivetran",2026-05-20,75000.0,75000.0,Austin, TX,US,75000.0
Data Analyst (Austin),State of Texas,Remote,"SQL, Python, R, statistics, data visualization, data governance, forecasting",2026-05-24,75000.0,75000.0,Austin, TX,US,75000.0
"ML Engineer - Evaluation Analysis, Metric and Data Strategy",Apple,On-site,"Python, R, scikit-learn, machine learning, statistics",2026-05-19,258100.0,258100.0,Culver City, CA,US,258100.0
Lead Marketing Data Analyst,Adobe,On-site,"SQL, Python, Databricks",2026-04-02,236400.0,236400.0,San Jose, CA,US,236400.0
"Senior Data Analyst, People Analytics",Uber,On-site,"SQL, Python, R, Excel, generative AI, statistics",2026-04-02,145500.0,145500.0,San Francisco, CA,US,145500.0
RAQA Data Analyst 3,Intuitive (Intuitive Surgical),Remote,"SQL, Python, R, Excel, Snowflake, machine learning, SAP, data visualization, business intelligence",2026-04-02,186400.0,186400.0,Sunnyvale, CA,US,186400.0
"People Data Analyst, People Operations (Contract)",Illumio,Hybrid,"SQL, Power BI, data modeling, data governance, Microsoft Fabric",2026-04-10,12000.0,12000.0,Sunnyvale, CA,US,12000.0
Business Intelligence Analyst / Data Analyst (SQL),Waymo,Remote,"SQL, Tableau, Looker, BigQuery, Redshift, data visualization, business intelligence",2026-04-09,207000.0,207000.0,Mountain View, CA,US,207000.0
Data Reporting Analyst - Production Support Engineer,Tata Consultancy Services (TCS),On-site,"Tableau, business intelligence",2026-04-08,130000.0,130000.0,Cupertino, CA,US,130000.0
Data Analyst - Part Time - Temp Position,Children's Health Council,On-site,"Excel, Tableau, Power BI, Looker, statistics, data visualization",2026-04-07,105000.0,105000.0,Palo Alto, CA,US,105000.0
Principal Operations Data Analyst,Pacific Gas and Electric,Hybrid,"SQL, machine learning, generative AI, SAP, Oracle",2026-04-06,238000.0,238000.0,Oakland, CA,US,238000.0
Data Analyst 1 Hybrid or Remote Opportunity,Stanford University,Hybrid,statistics,2026-04-06,89796.0,89796.0,Stanford, CA,US,89796.0
"Principal, Data Analyst - Transaction Analytics, Payments",Walmart,On-site,"SQL, Python, R, Tableau, Power BI, Looker, Spark, ETL, statistics, Scala, data visualization, data governance, business intelligence",2026-04-17,234000.0,234000.0,Sunnyvale, CA,US,234000.0
"Senior Data Analysis Engineer, AD Metrics - Autonomous Vehicles",NVIDIA,On-site,"Python, Agile",2026-04-17,253000.0,253000.0,Santa Clara, CA,US,253000.0
People Data Analyst,Applied Intuition,Remote,"Excel, statistics",2026-04-17,161000.0,161000.0,Sunnyvale, CA,US,161000.0
Data Analyst (Finance),UST,On-site,data modeling,2026-04-14,114000.0,114000.0,Santa Clara, CA,US,114000.0
"Member Data Analyst, Principal",Blue Shield of California,Hybrid,"SQL, Python, R, machine learning, LLM",2026-04-14,206690.0,206690.0,Oakland, CA,US,206690.0
Principal Technical Data Analyst - Finance,Intuit,On-site,"SQL, Python, Tableau, Databricks, ETL, AWS, statistics, Redshift, Qlik",2026-04-14,307000.0,307000.0,Mountain View, CA,US,307000.0
"Senior Data Analyst (Dublin, CA)",SavvyMoney,Hybrid,"SQL, Python, R, Excel, Tableau, Looker, Snowflake, machine learning, BigQuery, Redshift, data governance, business intelligence",2026-04-13,150000.0,150000.0,Dublin, CA,US,150000.0
"Senior Data and Reporting Analyst, Total Rewards",CRUSOE,On-site,"SQL, Python, R, Excel, Tableau, Power BI, Looker, LLM, forecasting",2026-04-13,145000.0,145000.0,San Francisco, CA,US,145000.0
Senior Data Analyst- Fraud & AML,Xai,On-site,"SQL, Python, machine learning, statistics",2026-04-23,220000.0,220000.0,Palo Alto, CA,US,220000.0
Recruiting Data Analyst,Discord,On-site,"SQL, Python, R, Excel, Tableau, Snowflake, data visualization, data governance",2026-04-24,171000.0,171000.0,San Francisco Bay Area, CA,US,171000.0
Sr. Portfolio Data Analyst,PlayStation,On-site,"SQL, Python, R, Excel, Tableau, Power BI, data modeling, data governance, forecasting",2026-04-24,220600.0,220600.0,San Mateo, CA,US,220600.0
Business Reporting Analyst,PayActiv,On-site,"SQL, ETL, data modeling",2026-05-01,115000.0,115000.0,Milpitas, CA,US,115000.0
Staff Technical Data Analyst - Finance,Intuit,On-site,"SQL, Python, Databricks, AWS, statistics, Redshift, data visualization",2026-05-01,232500.0,232500.0,Mountain View, CA,US,232500.0
HC Domain SME Data Analyst,Tata Consultancy Services (TCS),On-site,"SQL, Power BI, Databricks",2026-04-29,190000.0,190000.0,Pleasanton, CA,US,190000.0
Data Analyst,GetInsured,On-site,"SQL, Python, R, Tableau, Power BI, Looker, Snowflake, dbt, ETL, BigQuery, Redshift, data governance, Airflow, Fivetran",2026-05-04,100000.0,100000.0,Mountain View, CA,US,100000.0
Talent Acquisition Data & Reporting Analyst,Applied Materials,On-site,"Excel, Tableau, Power BI",2026-05-01,183500.0,183500.0,Santa Clara, CA,US,183500.0
Clinical Research Data Analyst II – Chronic Liver Diseases,PAVIR,On-site,"SQL, R, SAS, SPSS, statistics",2026-05-01,100000.0,100000.0,Palo Alto, CA,US,100000.0
GTM Data Analyst Intern,Everlaw,Hybrid,"SQL, Tableau, Looker, Snowflake, dbt, statistics, BigQuery, data visualization, data modeling",2026-05-01,7040.0,7040.0,Oakland, CA,US,7040.0
"Sr. Data Analyst, Financial Analytics",Sunrun,On-site,"SQL, Python, Excel, Tableau, Snowflake, dbt, Oracle, Jira, Agile",2026-05-06,146976.0,146976.0,San Francisco, CA,US,146976.0
Senior Data Analyst,HARVEY,On-site,"SQL, Python, Looker, dbt, machine learning, LLM, JSON",2026-05-06,210000.0,210000.0,San Francisco, CA,US,210000.0
Senior Data Analyst,Navan,On-site,"SQL, Snowflake, dbt, data visualization, data warehousing",2026-05-06,234400.0,234400.0,San Francisco, CA,US,234400.0
Senior Data Analyst,Navan,On-site,"SQL, Snowflake, dbt, data visualization, data warehousing",2026-05-06,234400.0,234400.0,Palo Alto, CA,US,234400.0
"Data Analyst, Business Intelligence",Doximity,Remote,"SQL, Python, Excel, Looker, statistics, Agile, data visualization, business intelligence",2026-05-08,150000.0,150000.0,San Francisco, CA,US,150000.0
"Data Analyst, Reporting Partnerships",Doximity,Remote,"SQL, Python",2026-05-08,134000.0,134000.0,San Francisco, CA,US,134000.0
Advanced Analytics & Reporting Analyst 3,Adobe,On-site,"Python, Power BI, Databricks, ETL, data modeling",2026-05-08,186200.0,186200.0,San Jose, CA,US,186200.0
Data Analyst I,Verdantas,On-site,"SQL, Python, R, Excel, Tableau, Power BI, statistics, data visualization",2026-05-07,68000.0,68000.0,San Ramon, CA,US,68000.0
Senior Data Analyst,Arlo Technologies,Hybrid,"SQL, Python, R, Tableau, Power BI, Looker, Databricks",2026-05-07,160000.0,160000.0,Milpitas, CA,US,160000.0
"Senior Data Analyst, Global Scaled Growth",TikTok,On-site,"SQL, Python, R, Tableau, Power BI, Looker, statistics, A/B testing, data visualization, forecasting",2026-05-13,288000.0,288000.0,San Jose, CA,US,288000.0
"Data Analyst, Supply Chain",Tesla,On-site,"SQL, Python, Tableau, Airflow",2026-05-12,113400.0,113400.0,Lathrop, CA,US,113400.0
Market Research Data Analyst,Apple,On-site,"SQL, Python, R, Tableau, statistics, data visualization",2026-05-19,221200.0,221200.0,Cupertino, CA,US,221200.0
CRM Data Analyst,Sterling Pacific Financial,Hybrid,Excel,2026-05-19,75000.0,75000.0,Watsonville, CA,US,75000.0
"Senior Data Analyst, Marketing Analytics",freshworks,Hybrid,"SQL, Python, R, Excel, Tableau, Power BI, Databricks, business intelligence",2026-05-18,160000.0,160000.0,San Mateo, CA,US,160000.0
Senior Fraud Strategy Data Analyst,Rippling,On-site,"SQL, Python, R, statistics",2026-05-16,168000.0,168000.0,San Francisco, CA,US,168000.0
Staff Data Analyst,Upstart,Remote,"SQL, Tableau, Looker, Spark, statistics, A/B testing",2026-05-15,217500.0,217500.0,San Mateo, CA,US,217500.0
"Supply Chain Sustainability Data Analyst, Recycled Content",Anew Global Consulting Ltd,On-site,"Tableau, data visualization",2026-05-15,120000.0,120000.0,San Francisco Bay Area, CA,US,120000.0
Senior Data Analyst,Zoom Communications,Hybrid,"SQL, Python, Tableau, Snowflake, dbt, statistics, data modeling",2026-05-14,228700.0,228700.0,San Jose, CA,US,228700.0
"Internship, Data Analyst, Energy (Fall 2026)",Tesla,On-site,"SQL, Python, Tableau, Git, Jira, data visualization, Airflow",2026-05-20,8000.0,8000.0,Fremont, CA,US,8000.0
Planner/Data Analyst,Perkins Eastman,Hybrid,"Python, R, Excel, Tableau, Power BI, data visualization",2026-05-19,90000.0,90000.0,San Francisco, CA,US,90000.0
Data Analyst,Hayden AI,Hybrid,"SQL, Python, Tableau, Looker, Snowflake, dbt, AWS, statistics, BigQuery, Redshift",2026-05-22,160000.0,160000.0,San Francisco, CA,US,160000.0
Research Data Analyst 2,Stanford University,On-site,"SQL, Python, Google Cloud, statistics, predictive analytics",2026-05-21,128138.0,128138.0,Stanford, CA,US,128138.0
Senior Technical Data Analyst - Operations E2E Data Intelligent Systems,NVIDIA,On-site,"SQL, Databricks, generative AI, SAP, Agile, data modeling, data governance",2026-05-21,310500.0,310500.0,Santa Clara, CA,US,310500.0
Precision Psychiatry and Neuroimaging Data Analyst,Stanford University,On-site,"Python, R, machine learning, statistics, data visualization",2026-05-20,99773.0,99773.0,Stanford, CA,US,99773.0
Stack Data Analysis Engineer,Bloom Energy,On-site,"Python, Excel, MySQL",2026-05-26,136900.0,136900.0,San Jose, CA,US,136900.0
Data Analyst,CRUSOE,On-site,"SQL, Python, Tableau, Power BI, Looker, dbt, GCP, Google Cloud, BigQuery, SAP, Oracle",2026-05-26,161000.0,161000.0,San Francisco, CA,US,161000.0
Data Analyst,Cardless,On-site,"SQL, Python, Excel, Tableau, Looker, forecasting",2026-05-27,200000.0,200000.0,San Francisco, CA,US,200000.0
Senior Revenue Data Analyst - Financial Reporting,NVIDIA,On-site,"SQL, Python, Excel, Tableau, Power BI, SAP, data modeling, data governance",2026-05-27,230000.0,230000.0,Santa Clara, CA,US,230000.0
"Senior, Operations Data Analyst - Reliability Strategy",Pacific Gas and Electric,Hybrid,"SQL, Excel, SAS, Oracle, data governance, predictive analytics, forecasting",2026-05-26,169000.0,169000.0,Oakland, CA,US,169000.0
Operations Data Analyst - Reliability Strategy,Pacific Gas and Electric,Hybrid,"SQL, Excel, SAS, Oracle, data governance, predictive analytics",2026-05-26,136000.0,136000.0,Oakland, CA,US,136000.0
Investor Reporting Analyst,"FAY Financial, LLC",Hybrid,Excel,2026-04-13,6080.0,6080.0,Farmers Branch, TX,US,6080.0
"Associate Principal, Business Analysis",Options Clearing Corporation,Hybrid,"SQL, Python, R, Tableau, AWS, Alteryx, Jira, Agile, Scrum, Kafka",2026-04-09,153000.0,153000.0,Dallas, TX,US,153000.0
Sr Business Data Analyst,DHL,On-site,"SQL, Python, R, Power BI, ETL, statistics, data visualization, data modeling, business intelligence",2026-04-08,115000.0,115000.0,Northlake, TX,US,115000.0
"Summer Intern - Human Resources (People Analytics, AI, Automation, Data Analyst)",U.S. Renal Care,Remote,Excel,2026-04-16,3360.0,3360.0,Plano, TX,US,3360.0
Data Analyst,Tata Consultancy Services (TCS),On-site,"SQL, Python, Power BI",2026-04-15,120000.0,120000.0,Lewisville, TX,US,120000.0
Bus. Systems Analysis Specialist,NTT DATA,Hybrid,"Excel, data governance",2026-04-24,95000.0,95000.0,Plano, TX,US,95000.0
SAP Master Data Analyst,,On-site,"SAP, data governance",2026-04-23,115000.0,115000.0,Dallas, TX,US,115000.0
Customer Remediation Quality Control Data Analyst - Consumer & Business Banking Risk,U.S. Bank,On-site,"SQL, Python, Excel, SAS",2026-04-22,124000.0,124000.0,Irving, TX,US,124000.0
Reporting Analyst - ELITE Dental Alliance,Cain Watters & Associates,Hybrid,"SQL, Python, Excel, Tableau, Power BI, statistics, data visualization",2026-04-21,5440.0,5440.0,Frisco, TX,US,5440.0
[Mid Level] Business Analyst 3 - Data Analysis & Business Intelligence (17181-1),JND,On-site,"SQL, Python, Excel, Tableau, Power BI, business intelligence, forecasting",2026-05-01,7040.0,7040.0,Plano, TX,US,7040.0
RWD Data Analyst Intern,Loopback Analytics,Hybrid,"SQL, Python, R, statistics",2026-05-04,5600.0,5600.0,Dallas, TX,US,5600.0
WMS Optimization Data Analyst,Eaton,On-site,"SQL, Python, Excel, Tableau, Power BI, SAP",2026-05-15,86000.0,86000.0,Dallas, TX,US,86000.0
"Service Delivery Center, Data Analyst - Senior",EY,Hybrid,"SQL, Snowflake, Databricks, ETL, AWS, Azure, MySQL, SAP, Oracle, data visualization",2026-05-20,152100.0,152100.0,Dallas, TX,US,152100.0
Senior Data Analyst,RealPage Inc,Remote,"SQL, Tableau, Power BI, Looker, statistics, data modeling, data governance, business intelligence",2026-05-20,145200.0,145200.0,Richardson, TX,US,145200.0
Data Analyst,UST,On-site,"SQL, Snowflake, Databricks, Azure, Oracle, data governance, forecasting",2026-05-22,159000.0,159000.0,Frisco, TX,US,159000.0
Specialist - Business Analysis,LTIMindtree,On-site,"SQL, ETL",2026-05-27,128080.0,128080.0,Irving, TX,US,128080.0
"Data Analyst II, Strategic Pipelines (226 Days)",Dallas Independent School District,On-site,"SQL, R, Excel, Tableau, Power BI, SPSS, statistics, data governance",2026-05-26,91458.0,91458.0,Dallas, TX,US,91458.0
Data Analyst II,Texas Health and Human Services Commission,On-site,statistics,2026-05-27,81348.0,81348.0,Terrell, TX,US,81348.0
"Analyst, Financial Planning & Analysis",Vistage Worldwide,Hybrid,"SQL, Tableau, Power BI, forecasting",2026-04-17,95000.0,95000.0,San Diego, CA,US,95000.0
UxS Data Analyst SME,"People, Technology & Processes",Remote,"Python, R, Excel, Tableau",2026-04-17,140000.0,140000.0,Coronado, CA,US,140000.0
Staff Technical Data Analyst - Finance,Intuit,On-site,"SQL, Python, Databricks, AWS, statistics, Redshift, data visualization",2026-05-01,232500.0,232500.0,San Diego, CA,US,232500.0
Commodity Pricing & Data Analyst,Calpine,On-site,Excel,2026-04-26,88448.0,88448.0,San Diego, CA,US,88448.0
Data Analyst,Booz Allen Hamilton,Hybrid,"SQL, Python, R, Tableau, Power BI, Spark, Databricks, TensorFlow, PyTorch, scikit-learn, data visualization",2026-05-18,141000.0,141000.0,San Diego, CA,US,141000.0
Commodity Data Analyst,Calpine,On-site,Excel,2026-05-22,88449.0,88449.0,San Diego, CA,US,88449.0
Research Data Analyst,Leidos,On-site,"Python, MATLAB",2026-05-20,104575.0,104575.0,San Diego, CA,US,104575.0
"(USA) Senior, Data Analyst",Walmart,On-site,"SQL, Python, R, Tableau, Power BI, Spark, statistics, Scala, business intelligence",2026-04-22,155000.0,155000.0,New Braunfels, TX,US,155000.0
Reporting Analyst II,,On-site,"SQL, Excel, statistics",2026-04-02,85700.0,85700.0,Bala-Cynwyd, PA,US,85700.0
Incentives Data Analyst,"Subaru of America, Inc.",Hybrid,Excel,2026-04-14,70000.0,70000.0,Camden, NJ,US,70000.0
Customer Remediation Quality Control Data Analyst - Consumer & Business Banking Risk,U.S. Bank,On-site,"SQL, Python, Excel, SAS",2026-04-22,124000.0,124000.0,Horsham, PA,US,124000.0
Principal Data Analyst,University of Pennsylvania,On-site,machine learning,2026-04-21,104792.0,104792.0,Philadelphia, PA,US,104792.0
Metrics Data Analyst,SAIC,Remote,"SQL, Python, R, Excel, Tableau, Qlik, Oracle, Java, business intelligence",2026-04-17,120000.0,120000.0,Lakehurst, NJ,US,120000.0
Enterprise Resource Planning (ERP) Data Analytics and Reporting Analyst,"City of Philadelphia, PA",On-site,business intelligence,2026-05-06,90000.0,90000.0,Philadelphia, PA,US,90000.0
Revenue Cycle Data Analyst - FT - Day - Revenue Integrity & Denials Mgmt Lawrenceville NJ,Capital Health,On-site,Excel,2026-05-11,84448.0,84448.0,Princeton, NJ,US,84448.0
Data Analyst,RxSense,Remote,"SQL, Tableau, Snowflake, statistics, MongoDB, Qlik, data governance",2026-05-08,100000.0,100000.0,Princeton, NJ,US,100000.0
Business Reporting Analyst II,Burlington Stores,Remote,"SQL, Excel, Power BI, business intelligence",2026-05-15,80000.0,80000.0,Burlington, NJ,US,80000.0
Power BI Data Analyst,Worth & Company,On-site,"SQL, Power BI",2026-05-27,70000.0,70000.0,Pipersville, PA,US,70000.0
Vista Viewpoint Data Analyst,Worth & Company,On-site,"SQL, Power BI, statistics",2026-05-27,110000.0,110000.0,Pipersville, PA,US,110000.0
Trusts and Estates Tax Data Analyst,JPMorganChase,On-site,"Python, Excel, Tableau, Alteryx",2026-05-26,79500.0,79500.0,Newark, DE,US,79500.0
Digital Content Data Analyst - The Company Store,The Home Depot,On-site,Excel,2026-05-26,70000.0,70000.0,Trenton, NJ,US,70000.0
Institutional Research Manager (Data Scientist) - Institutional Research Analysis Department,City University of New York,On-site,"SQL, Python, Excel, Tableau, SAS, machine learning, Java, data visualization, data governance, predictive analytics",2026-05-20,113982.0,113982.0,New York, NY,US,113982.0
Data Scientist II - Client Analysis,Socure,Remote,"SQL, Python, Tableau, Looker, Spark, Snowflake, Databricks, AWS, Azure, GCP, machine learning, Redshift, Airflow",2026-05-20,150000.0,150000.0,New York, NY,US,150000.0
Customer Remediation Quality Control Data Analyst - Consumer & Business Banking Risk,U.S. Bank,On-site,"SQL, Python, Excel, SAS",2026-04-22,124000.0,124000.0,Tempe, AZ,US,124000.0
"(USA) Senior, Data Analyst",Walmart,On-site,"SQL, Python, R, Tableau, Power BI, Spark, statistics, Scala, business intelligence",2026-04-22,155000.0,155000.0,Buckeye, AZ,US,155000.0
Student Services Analyst-Student Data Analyst,Mesa Community College,On-site,Tableau,2026-04-15,68282.0,68282.0,Mesa, AZ,US,68282.0
HR Data Analyst,LifeStance Health,Remote,SQL,2026-05-19,76900.0,76900.0,Scottsdale, AZ,US,76900.0
Marketing Analytics and Reporting Analyst,Unitek Learning,On-site,"SQL, Excel, Power BI, generative AI, statistics, data visualization, data modeling, data governance, business intelligence",2026-05-16,90000.0,90000.0,Tempe, AZ,US,90000.0
Data Analyst - Travel Demand Modeler,Houston-Galveston Area Council,On-site,"Python, R, Tableau",2026-04-06,82000.0,82000.0,Houston, TX,US,82000.0
Data Analyst,Meneses Law,On-site,"SQL, Python, Excel, Power BI, data visualization",2026-04-13,70000.0,70000.0,Houston, TX,US,70000.0
Business Analyst/Data Analyst,Edurech Technoogy,Hybrid,"SQL, Python, Excel, Tableau, Power BI, AWS, Azure, GCP, statistics, Jira, Agile, Scrum, data modeling",2026-05-01,107015.0,107015.0,Texas City, TX,US,107015.0
Transmission Analyst (Grid Integration & Analysis),Pattern Energy Group,Hybrid,"Python, R, Excel, statistics",2026-05-07,108000.0,108000.0,Houston, TX,US,108000.0
Data Analyst,Arya Groups,On-site,"SQL, Python, Excel, Tableau, Power BI",2026-05-13,100000.0,100000.0,Texas City, TX,US,100000.0
Data Analyst - Surgical Oncology Research,MD Anderson Cancer Center,Hybrid,"SQL, Python, R, machine learning, deep learning, LLM, NLP, data governance",2026-05-20,86500.0,86500.0,Houston, TX,US,86500.0
"Sr. Value-Based Healthcare Data Analyst - Kelsey-Seybold, Pearland, TX",Optum,On-site,"SQL, Python, R, Excel, Tableau, Power BI, SAS, ETL, statistics, business intelligence",2026-05-20,163700.0,163700.0,Pearland, TX,US,163700.0
Data Analyst,West Green Point Collective,On-site,"SQL, Python, R, Tableau, Power BI, Looker, A/B testing, data visualization, business intelligence, forecasting",2026-05-25,65055.0,65055.0,Houston, TX,US,65055.0
Market Research Data Analyst,James Hardie Building Products,On-site,"SQL, Python, R, Tableau, Power BI, data warehousing",2026-04-06,115000.0,115000.0,Chicago, IL,US,115000.0
Market Data Analyst,Chicago Trading Company,Hybrid,"Excel, forecasting",2026-04-01,120000.0,120000.0,Chicago, IL,US,120000.0
Data Analyst,AIT Worldwide Logistics,On-site,"Tableau, Power BI",2026-04-13,124090.0,124090.0,Itasca, IL,US,124090.0
Senior Finance Data Analyst,Encore Global,On-site,"SQL, Excel, Tableau, Power BI, data governance, business intelligence, Microsoft Fabric",2026-04-10,110902.0,110902.0,Schiller Park, IL,US,110902.0
Data Analyst,Honeycomb Insurance,On-site,"SQL, Python, R, Tableau, Power BI, Looker, dbt, ETL, BigQuery, Airflow, Fivetran",2026-04-22,170000.0,170000.0,Chicago, IL,US,170000.0
Data Analyst,HAVI Logistics GmbH,Hybrid,"SQL, Python, R, Power BI, Databricks, Azure",2026-04-22,95000.0,95000.0,Chicago, IL,US,95000.0
Senior Data Analyst,Fresenius Kabi USA,Remote,"SQL, Python, R, Excel, Tableau, Power BI, statistics, data visualization",2026-04-20,110000.0,110000.0,Lake Zurich, IL,US,110000.0
Senior Data Analyst,Stellar Solutions,On-site,"SQL, Python, Tableau, Power BI, Snowflake, Databricks, AWS, data warehousing",2026-04-27,6720.0,6720.0,Chicago, IL,US,6720.0
SENIOR DATA ANALYST – PEOPLE ANALYTICS,IMC Financial Markets,On-site,"SQL, Python, Tableau, Power BI, ETL, statistics, Qlik, SAP, Oracle, forecasting",2026-04-27,180000.0,180000.0,Chicago, IL,US,180000.0
Data Analyst,Wilson Elser,Hybrid,"SQL, Excel, Power BI, Jira, data visualization",2026-04-24,90000.0,90000.0,Chicago, IL,US,90000.0
